letter, question, answer

A, Avustralya ve Yeni Zelanda Kolordusu, Anzak
A, Yeşil renkte tropik bir meyve, Avokado
A, Bir kimsenin emek vermeden sağladığı kazanç, Avanta
A, Duru, sakin havada çıkan kuru soğuk, Ayaz
A, Çabuk davranan, çevik, Atik
A, Tavana asılan, şamdanlı, lambalı, cam veya metal süslü aydınlatma aracı, Avize
A, Çevresinde olup bitenlerin farkına varmayan, sezmeyen kimse, gözü bağlı, gafil, Aymaz
A, Belirli bir günün, olayın bir önceki günü veya ona yakın günler, Arife
A, Dünyanın, bir ülkenin, bir bölgenin fiziksel ve siyasal coğrafyası ile ekonomi, tarih vb. konularda toplu bilgi vermek için bir araya getirilmiş coğrafya haritaları derlemesi, Atlas
A, Eski Türk devletlerinde, özellikle Selçuklularda şehzadelerin eğitimi veya bağımsız olarak bir eyaletin yönetimi ile görevli vezir, Atabey
A, Subaylarda üniformaların omuzlarına takılan, rütbenin sembolünü gösteren parça, Apolet
A, Kur'an-ı Kerim'i oluşturan, başı ve sonu belli olan, harf, kelime veya cümleden oluşan Allah'ın sözleri, Ayet
A, Hayat, felsefe veya ahlak hakkında genel kabul görmüş bir gerçeği, derin bir düşünceyi en az kelimeyle, çarpıcı ve akılda kalıcı bir şekilde ifade eden özlü söz, Aforizma
A, Közlenmiş patlıcan, sarımsaklı yoğurt ve kıyma ile yapılan bir yemek türü, Alinazik
A, Aynı uğraş alanındaki insanların, kullanılan ortak, genel dilden ayrı olarak, benimseyip kullandıkları, herkesçe anlaşılamayan, kendilerine özgü sözcük ve deyimlerin yer aldığı özel dil, Argo
A, Elektrik akımı birimi, Amper
A, Baş aşağı dik durma hareketi, Amut
A, Dünyanın en büyük tropikal yağmur ormanı, Amazon
A, Bir hizmet karşılığı sürekli ve düzenli ödenen para, Aidat
A, Yaşadığı ortamdaki insanlar ve kurallarla uyumlu olmayan, kendi düşünce ve eylemleriyle oluşturduğu yaşam biçimine göre hareket eden, Asi
A, Üzüntüden ve sıkıntıdan uzak, rahat ve sakin olan, Asude
A, Güçlükle tutuşan, koku, duman çıkarmadan büyük bir ısı vererek yanan bir taş kömürü türü, Antrasit
A, Gerekli notların unutulmaması için yazıldığı takvimli defter, Ajanda
A, Vücudumuzdaki proteinlerin yapıtaşları, Amino Asit
A, Mecaz anlamda bir olayı, bir durumu yansıtan, göz önünde canlandıran olay, durum, Ayna,
A, Şiir ve nesirde uyum sağlamak için söz başlarında ve ortalarında aynı ünsüzün veya aynı hecelerin tekrarlanması, Aliterasyon
A, Kırılmış kemiklerin düzgün bir biçimde sarılabilmesi için kullanılan türlü malzemelerden yapılmış destek, Atel
A, Genellikle kadınların kullandığı bir seslenme sözü, Ayol
A, Övme, takdir, beğenme vb. duyguları belirtmek için söylenen söz, Aferin
A, Duygu sömürüsü yapma, Ajitasyon
A, Serbest bırakma, Azat
A, Süs taşı olarak kullanılan, mor renkte bir kuvars türü, Ametist
A, Türkçede "ama, fakat, lakin" veya "sadece, yalnızca" anlamlarına gelen, cümleye zaman veya zorunluluk anlamları katabilen işlevsel bir bağlaç ve edat, Ancak

B, Bir bilgisayarda verileri geçici saklayan donanım, Bellek
B, Dana veya sığırın göğüs eti veya döş bölgesi, Brisket
B, Sacda pişirilmiş yuvarlak ekmek, Bazlama
B, Düz veya kıvrımlı her çeşit yumuşak kumaş, slikon vb. malzemeden yapılan başlık, Bone
B, Müzik eşliğinde içki içilen, yemek yenilen bir tür lokanta, Bistro
B, Bir sınıflama ve dereceleme yapabilmek için belirlenmiş olan ölçü sistemi, Barem
B, Dalın gövde içindeki başlangıç yeri olan ve tahtalarda görülen, yuvarlak ve koyuca renkte sert bölüm, Budak
B, Şişman, gürbüz iri cüsseli çocuk, Balaban
B, Hayvanların, arka bacaklarının gövdeye bitişik olan dolgun, etli bölümü, But
B, Başıboş, serseri kimse, Berduş
B, Atom numarası 5 olan, bileşikleri sabun, cam, porselen yapımı gibi çeşitli yerlerde kullanılan element, Bor
B, Şehirde yaşayan, üretim araçlarını ellerinde bulunduran ve kendi başına üretim ve kazanç yollarında çalışarak kendine geniş bir geçim sağlayan kimse, Burjuva
B, Yeryüzündeki herhangi bir noktanın meridyen çemberiyle başlangıç olarak alınan Greenwich Gözlemevi'nin meridyen çemberi arasındaki açı değeri, meridyen, Boylam
B, Eşleri kardeş olan erkeklerin birbirine göre durumu, Bacanak
B, İslam dininde Hz. Muhammed zamanından sonra ortaya çıkan değişik yargılar ve ilkeler, Bidat
B, Amerika'da yaşayan bir cins hörgüçlü yaban öküzü, Bizon
B, Bitki bilimi, Botanik
B, Sulu, cıvık hamur, Bulamaç
B, İki direkli, seren yelkenli, birkaç top taşıyan gemi, Brik
B, Çoğunlukla mor kadife üzerine sırma ile kabartma dal, yaprak ve çiçek işlenmiş, uzun kollu, boyu yere kadar uzanan, önü açık giysi, Bindallı
B, Enine göre boyu kısa ve tıknaz, Bodur
B, Bir işe, bir duruma, bir harekete sonucunun ne olacağını düşünmeden girişmek, Balıklama
B, Siyasal anlamda Avrupa ve Kuzey Amerika, Batı
B, Herkesçe kullanılan, anlaşılan, Banal
B, Jeolojide herhangi bir aşınma sürecinde veya taşıma işi yapılırken alüvyonlu maddelerin bırakılması, Birikim
B, Öpücük, Buse
B, Su biriktirmek için akan suyun önüne yapılan set, Bent
B, Bir şiirdeki dörtlüklerin her biri, Bent
B, Bir konuda hazırlıksız konuşabilme yeteneği, Bedahet
B, Arpa, darı, mısır, buğday vb. tahılların hamurunun ekşitilmesiyle yapılan koyuca, tatlı veya mayhoş içecek, Boza
B, Yolcu taşıtlarında yüklerin konulduğu yer, Bagaj
B, Kadınların saçlarını kıvırmak için kullandıkları, metal, sünger veya plastikten, boru biçiminde küçük araç, Bigudi
B, Isı etkisiyle sıvıların ve bazı katıların dönüştükleri gaz durumu, Buhar

C, İlgi uyandıran, elverişli, Cazip
C, Bilgisayarın işlem yapan ana bileşeni, CPU
C, Genellikle dükkânlarda malların sergilendiği camlı bölme, Camekan
C, İslam ülkelerinde Müslüman olmayanlardan alınan bir vergi türü, Cizye
C, Düşüncesizce, saygıyı aşan davranış, Cüret
C, Bir ülkede yönetime silah zoruyla el koyan kimselerden oluşan kurul, Cunta
C, Hansen basilinin sebep olduğu, sinir sistemi ve deri başta olmak üzere birçok sistem ve organı etkileyebilen bulaşıcı bir hastalık, Cüzzam
C, Ezilmiş havuç içine fındık veya ceviz parçaları eklenerek yapılan bir tatlı türü, Cezerye
C, Savaşta kahramanlık gösteren kimse, Cengaver
C, Her türlü çıkar düşüncesinden uzak, Candan
C, Atletizmde kullanılan ucu sivri, üzeri sargılı metal sırık, Cirit
C, Mecaz anlamda bir şeydeki aldatıcı, göz boyayıcı durum, Cila
C, Osmanlı Devleti'nde atlı olan ve savaşlarda padişahın önünde düşmana karşı ilk saldırıya geçen birlik, Cambaz
C, Bir yöne doğru akma, Cereyan
C, Eski dilde başladığı işi ustalıkla, becerikli bir biçimde başarma, Cerbeze
C, Katolik Kilisesi'nde erkekler için papalık hakkına sahip düzenli din adamları tarikatı, Cizvit
C, Karşısındakini ağız kalabalığı ile yıldıran kimse, Cadaloz
C, İlgi uyandırmayan, sönük olan anlamında kullanılan bir sıfat, Cansız
C, Sert bir şey yırtılırken çıkan ses, Cart
C, Çok anlamı olan bir kelimenin iyi anlamını kullanır görünerek kötüsünü öne çıkarma, Cinas
C, İnce, acı ve yüksek sesle bağırmak, Cıyaklamak
C, Manevi açıdan yapılan baskı, Cendere
C, Patates, mısır vb. yapılan gevrek atıştırmalık, Cips
C, Küçük ve sevimli kız çocuğu, Cimcime

D, Sıkı düzen, düzence, düzen bağı, inzibat, zapturapt, Disiplin
D, Tırtıllı veya lastik tekerlekli yol yapım makinesi, Dozer
D, Kuzey Yarım Küre'nin genellikle ılıman bölgelerinde yetişen, yapraklarıyla ipek böceği beslenen ağaç, Dut
D, Tekerleklerin merkezinden geçen ve taşıtın altına enlemesine yerleştirilmiş mil, Dingil
D, Yerini değiştirmeyen, hareketsiz, sabit, Durağan
D, Gelinin başını, bazen de yüzünü örten dantel veya tülden örtü, Duvak
D, Her türlü iplikle örülen veya bir kumaşın kenarına işlenen türlü biçimde ince ve ağ görünümünde örgü, Dantel
D, Hava sıcaklığının sıfırdan aşağı düşmesiyle suların buz tutması, Don
D, Başında saçı olmayan kimse, Dazlak
D, Üstü şekerli, renkli ve parlak bir madde ile kaplanmış hap, Draje
D, Geri bildirim, Dönüt
D, Yargı organınca hükme bağlanması gereken konu, Dava
D, Uluslararası ilişkileri düzenleyen antlaşmalar bütünü, Diplomasi
D, Karelere ayrılmış zemin üzerinde on altı taşla iki kişi arasında oynanan oyun, Dama
D, Avrupa ülkelerinde prensten sonra gelen en yüksek soyluluk ünvanı, Dük
D, Simit gibi delikli veya deliksiz biçimde olan, şeker ve yağla yapılan bir tür tatlı çörek, Donut
D, Dük eşi, Düşes
D, Metin içinde geçen herhangi bir bilgi ile ilgili olarak sayfa altına, çalışmanın sonuna konulan açıklama veya kaynak bilgisi, Dipnot
D, Bir akarsuyun herhangi bir kesiminden saniyede geçen suyun hacmi, Debi
D, Havalanan tozların veya sisin oluşturduğu bulanıklık, Duman
D, Taştan veya ağaçtan yapılmış büyük havan, Dibek
D, Tanrı'ya, doğaüstü güçlere, çeşitli kutsal varlıklara inanmayı ve tapınmayı sistemleştiren toplumsal bir kurum, Din

E, Belirti, ipucu, iz, Emare
E, İki sabit noktadan olan uzaklıklarının toplamı aynı değere eşit olan noktalardan oluşan kapalı eğri, Elips
E, Mal ve değerlere ait döküm, Envanter
E, Vücut kemiklerinin uç uca veya kenar kenara gelip birleştiği yer, Eklem
E, Et veya tavuk suyuna kırmızı mercimek, yağ, nane, karabiber, kırmızıbiber karıştırılarak pişirilen ve Anadolu'da yaygın olan bir çorba türü, Ezogelin
E, İhalelerde sözleşme fiyatının maliyetlerdeki artışa göre güncellenmesi, Eskalasyon
E, Hekimlikte kullanılan, çok uçucu, renksiz ve kendine özgü kokusu olan bir sıvı, Eter
E, Kişisel haklarını kendi kullanabilmesi için yasanın gösterdiği on sekiz yaşına gelmiş olan kimse, Ergin
E, Yazıları yeniden düzenleyerek yayıma hazırlayan kimse, Editör
E, Deprem, rüzgâr, sel vb. iç ve dış etmenlerin etkisiyle oluşan yayla, ova, koyak, çukur, dağ vb. biçimlerin bütünü, Engebe
E, Köken bilimi, Etimoloji
E, Birine geçici olarak bırakılan ve teslim alınan kişice korunması gereken eşya, Emanet
E, Bir cihazın başka bir işletim sistemini veya donanımı taklit ederek o sisteme ait yazılım ve oyunları çalıştırmasını sağlayan platform, Emülatör
E, Klasik dönem Osmanlı saraylarında sultanın hayatını geçirdiği, harem ve hazine dairelerinin bulunduğu iç bölüm, Enderun
E, Bir görevde uzun süre kalıp o işe emeği geçmiş olan kimse, Emektar
E, Müslümanlıkta namaz vaktini bildirmek için müezzinin yüksek sesle yaptığı çağrı, Ezan
E, Belli kurallara göre düzenlenmiş, kulağa hoş gelen ses dizisi, ahenk, Ezgi
E, Boy pos, Endam
E, Bütünleşmiş, Entegre
E, Matematikte kümeye ait varlıklardan her biri, Eleman
E, Bir işten anlayan, bir işi iyi yapan kimse, Erbap
E, Bakanlık ve elçilikten başlayarak cumhurbaşkanlığına kadar yükselen, yüksek makam sahibi yabancılara verilen şeref ünvanı, Ekselans
E, Köken bilimi, Etimoloji
E, Genellikle virüs veya bakteri kaynaklı enfeksiyonlar nedeniyle ince bağırsağın iç zarının iltihaplanması durumu, Enterit
E, Çocukların ve gençlerin toplum yaşayışında yerlerini almaları için gerekli bilgi, beceri ve anlayışları elde etmelerine, kişiliklerini geliştirmelerine okul içinde veya dışında, doğrudan veya dolaylı yardım etme, Eğitim

F, Evre, safha, Faz
F, Pürüzsüz göstermek veya renk vermek için cilde sürülen, yarı sıvı veya boyalı krem, Fondöten
F, Taşıtların ön bölümünde bulunan, kısa ve uzun mesafeyi aydınlatmaya yarayan ışık düzeneği, Far
F, Kadınların sokakta giydikleri, mantoya benzer, arkası bol, yakasız, çoğu kez eteklere kadar uzayan üst giysisi, Ferace
F, Cankurtaran sandalı, Filika
F, Eski Mısır hükümdarlarına verilen ünvan, Firavun
F, Olağandan bol, aşırı çoklukta bulunma durumu, Furya
F, Akışkan içindeki yabancı maddeleri veya istenmeyen parçacıkları ayırarak temizlenmesini sağlayan, süzme işlemi yapan araç, Filtre
F, Toplanan süprüntüleri alıp atmak için kullanılan teneke veya plastikten yapılmış bir tür kürek, Faraş
F, İlaçların organizma üzerindeki etkisini inceleyen ilaç bilimi dalı, Farmakodinami
F, Elektrik ampullerinden akım geçtiğinde akkor duruma gelen ince iletken tel, Filaman
F, Bir siyasi partinin politikasını parlamentoda, yerel yönetimlerde, çeşitli kuruluşlarda yürütmek için teşkilatlanmış grup, Fraksiyon
F, Kanun maddelerinin kendi içlerinde satır başlarıyla ayrıldıkları ufak bölümlerden her biri, Fıkra
F, Bir amaç uğrunda bir değer veya varlıktan vazgeçme, Feda
F, Devlet başkanlarının bulunduğu yerlere ve bindiği taşıtlara çekilen, özel biçimli bayrak, Fors
F, Bir sorunun dinî hukuk kurallarına göre çözümünü açıklamak amacıyla müftü veya şeyhülislam tarafından  yapılan açıklama, Fetva
F, Herhangi bir dilde yer alan seslerin fiziksel özellikleri, Fonetik
F, İran'ın güneybatısında yaşayan halk, Fars
F, Tutsak edilen veya rehin alınan bir kimsenin serbest bırakılması için istenen para, Fidye
F, Varsayımsal, Farazi
F, Lağım çukuru, Foseptik
F, Çay, kahve vb. sıcak şeyler içmekte kullanılan, genellikle kulplu, porselen veya camdan yapılmış küçük kap, Fincan
F, Bir şeye, bir kimseye aşırı hayranlık duyan kimse, Fan
F, Mor ve pembe tonlarının birleşiminden oluşan canlı, parlak bir renk, Fuşya
F, Bir şehir veya ülkeyi savaşarak alma, Fetih
F, Kur'an'ın ilk suresi, Fatiha
F, Meyve şekeri, Fruktoz
F, Aşırı milliyetçilik, otoriterlik, militarizm ve anti-demokratik yapıya dayanan, devletin bireyden üstün görüldüğü sağcı bir siyasi ideoloji, Faşizm

G, Bir maddenin en küçük tanesi, Granül
G, Yazılım projelerini tutan popüler versiyon kontrol sistemi, Git
G, Bir yerleşim bölgesinin, aynı şehir, ülke veya kültürden gelen insanların yerleştiği bölümü, Getto
G, İnek sütünden yapılan, sert yapılı, açık sarı renge sahip ve gözenekli bir peynir, Gravyer
G, Genellikle Venedik'te kullanılan, ayakta, kıç tarafta tek kürekle yürütülen, 10 metre uzunluğunda, yassı ve iki başı yukarıya kıvrık kayık, Gondol
G, Bir iletkenin uçları arasındaki gizil güç farkı, potansiyel farkı, voltaj, Gerilim
G, Doğup yaşanılmış olan yerden uzak yer, Gurbet
G, Kamıştan yapılmış çift düdük ve tulumdan oluşan, tiz sesli, nefesli, İskoçların millî çalgısı, Gayda
G, Ölü yıkama yeri, Gasilhane
G, Argoda karısının veya bir kadın yakınının ihanetine uğramış erkek, Geyik
G, Yersiz, beceriksiz, zamansız söz veya davranış, Gaf
G, Yemek yenilen, gösteri izlenen, müzik dinlenen, bazen oyun sergilenen eğlence yeri, Gazino
G, İslam dinini korumak veya yaymak amacıyla Müslüman olmayanlara karşı yapılan kutsal savaş, Gaza
G, Bir şeye veya bir kimseye özgü olmayıp onun bütün benzerlerini içine alan, Genel
G, Orta Çağ'a özgü, Gotik
G, Her sene basılan ve hem insanlar tarafından kırılan hem de doğanın aşırılıklarının neden olduğu dünya rekorlarını barındıran bir referans kitabı, Guinness
G, Bir kamu kuruluşunu veya özel kuruluşu yöneten kimse, Guvernör

H, Tütün kıyma makinesi, Havan
H, İşe yaramayacak derecede bozulmuş, zarar görmüş, Hurda
H, Saray ve konaklarda kadınlara ayrılan bölüm, selamlık karşıtı, Harem
H, Yaşlanmış kimselerin bakımlarının yapıldığı ve barındığı kurum, Huzurevi
H, Suları aynı deniz, göl veya nehre akan, dağ veya tepelerle sınırlanmış kara parçası, Havza
H, Güneybatı Afrika’da yaşayan ilkel bir boy, Hotanto
H, Kiremit ve tuğla tozlarının kireç ve su ile karıştırılmasından elde edilen bir harç türü, Horasan
H, Zevki için para harcamaktan kaçınmayan kimse, Hovarda
H, İnsanın yaradılış ve ruh özelliklerinin, eğilimlerinin ve içgüdülerinin bütünü, Huy
H, Arap alfabesiyle güzel yazı yazma sanatı ve bu biçimde yazılmış yazı, Hat
H, Verilen karara göre, karar gereği anlamına gelen bir zarf, Hükmen
H, Toprağı kazma, kazı, Hafriyat
H, Şanlıurfa'nın "Batık Şehir" olarak da anılan ilçesi, Halfeti
H, Cennette yaşadığına inanılan dişi varlık, Huri
H, Silahlı soygun yapan, yol kesen kimse, Haydut
H, İçine mürekkep konulan küçük kap, Hokka
H, iki farklı türün, teknolojinin veya enerji kaynağının bir araya getirilerek tek bir yapıda kullanılması, melez, Hibrit
H, Etkili söz söyleme sanatı, Hitabet
H, Genellikle mersin balığının salamura edilmiş yumurtası; balık yumurtası, Havyar
H, İstemeyerek ve bilmeyerek yapılan yanlış, Hata
H, Uçak, araba, tarım aracı vb. nesneleri barındırmaya yarar kapalı yer, Hangar
H, Ayrışık, homojen zıttı, Heterojen
H, Doğru bir çizgi üzerinde bulunma durumu, Hiza
H, Bir topluluk, kongre vb. yerlerde katılanları ağırlayan, onlara kılavuzluk eden erkek, Host
H, Bir cismin uzayda doldurduğu boşluk, Hacim
H, Kur'an'ın her cüzünün beş sayfalık bölümü, Hizip
H, Bağış, Hibe
H, Dışarıdan gerçek bir uyarıcı olmadığı halde, kişinin 5 duyu organından biri veya birkaçı aracılığıyla gerçek dışı görüntüler, sesler, kokular, tatlar veya dokunuşlar algılaması, Halüsinasyon
H, Daha ziyade gençlerin ve araştırmacıların konaklaması için yapılmış ve belirli kurallara göre yönetilen ucuz tesis, Hostel
H, Uçaklarda yolcu ağırlayan kadın, Hostes
H, Fanatizmden beslenen, aşırı davranışlarda bulunan ve çevreye zarar vermeye eğilimli taraftar, Holigan
H, Dinleyenleri etkilemek veya heyecanlandırmak amacıyla yapılan abartılı anlatım, Hamaset
H, İnsanlara, evlere veya tarım ürünlerine zarar veren, rahatsızlık uyandıran küçük böcekler, eklem bacaklılar ve bazı küçük canlıla için kullanılan terim, Haşere

İ, Yumuşak bölümleri dökülmüş, ölü bir vücudun kemiklerinin bütünü, İskelet
İ, Halk arasında çarpan balığı ismiyle de bilinen balık, İskorpit
İ, Akıl dışı, mantıksız, İrrasyonel
İ, Kişinin ırk, din, milliyet, siyasi görüş veya belirli bir sosyal gruba mensubiyeti nedeniyle kendi ülkesinde zulüm görme korkusuyla başka bir ülkeye sığınma talebinde bulunması, İltica
İ, Bir çağrıyı yerine getirme, bir çağrıya gitme, İcabet
İ, Cinsel konularda ahlak kurallarına bağlılık, İffet
İ, Toplum düzenini ve yapısını daha iyi duruma getirmek için yapılan köklü değişiklik, İnkılap
İ, Bir şeyi yapıp yapmama konusunda kişinin kendi kendine karar verebilme ve bunu uygulama gücü, İrade
İ, Su koymaya yarayan kulplu, emzikli kap, İbrik
İ, Bir hastalığı iyi etmek veya önlemek için türlü yollarla kullanılan madde, İlaç
İ, Dolmuş taşımacılığında belli bir alan içinde yapılan en kısa yolculuk, İndibindi
İ, Vücudun mikroplara karşı koymak için herhangi bir yerine fazla kan hücumu ile orada şişkinlik, kırmızılık, ısı ve ağrı ile beliren irin toplaması, İltihap
İ, Tren, metro durağı, İstasyon
İ, Gereksiz yere para, zaman, emek vb. harcama, savurganlık, İsraf
İ, Söz dinleme, boyun eğme, buyruğa uyma, İtaat
İ, Kendi cinsinden olanlara göre dar ve kalınlığı az olan, İnce
İ, Sürdürme, devam etme, İdame
İ, Bir şeyi armağan olarak verme, sunma, İkram
İ, Nöbeti hastane yerine evde tutan ve her an hastaneden çağrılmayı bekleyen doktor, İcapçı
İ, Teklifsiz konuşmada anlışlığı sebebiyle gülünç olan söz veya cümle, İnci
İ, Taklit, İmitasyon
İ, Arapça'da biçim değiştirme, İstihale
İ, Osmanlı Devleti'nin fethettiği toprakları kalıcı hale getirmek, Türkleştirmek ve İslamlaştırmak amacıyla uyguladığı yerleştirme ve yurtlandırma politikası, İskan
İ, Bir kimseye çalıştığı yerce verilen tatil, İzin
İ, Felsefede zihinsel bir düşünce, kavram, tasarım veya bir nesnenin zihindeki görüntüsü, İde

K, Motorlu araçları çalıştırmaya yarayan düzenek, Kontak
K, Suç bilimi, Kriminoloji
K, Duvar örmekte kullanılmak için kalıplara dökülüp güneşte kurutulmuş saman ve balçık karışımı ilkel tuğla, Kerpiç
K, Devlet yönetiminde cumhurbaşkanı veya başbakan başkanlığında toplanan bakanlar kurulu, Kabine
K, Silisyum ve oksijen atomlarından oluşan sert, kristalli bir mineral, Kuvars
K, Bir ilçede devleti temsil eden en yetkili yönetim görevlisi, Kaymakam
K, Tırnak, boynuz, kıl gibi üst deri ürünü olan yapıları oluşturan proteinli madde, Keratin
K, Gemide güverte hizasında ıskarmoz bağlarına tutturulan dikmelerin dış yüzlerine kaplanan kaplamaların oluşturduğu siper, güverteden yukarı kalan bölüm, Küpeşte
K, Bir araştırma veya incelemede yararlanılan çalışmaları gösteren liste, Kaynakça
K, Pişen yemeği başka kaba boşaltmak, Kotarmak
K, Çok sayıda kadınla ilişki yaşayan, çapkın, karizmatik ve baştan çıkarıcı erkekler için kullanılan bir sıfat, Kazanova
K, Bir olayın gerçekleşeceğini önceden bilme, prediksiyon, Kehanet
K, İkinci Dünya Savaşı yıllarında Japonların kullandığı intihar uçağı, Kamikaze
K, Ağır bir yükün kaldırılmasını veya otomobil vb. taşıtların yerden yükseltilmesini sağlayan alet, Kriko
K, Hareket sisteminin yapı taşlarını, özellikle kemik, lif ve eklemleri oluşturan protein, Kolajen
K, Hareket olaylarını inceleyen bilim dalı, Kinetik
K, Her türlü durum ve şartın ortaya çıkardığı sonuç anlamına gelen Fransızca kökenli bir sözcük, Konjonktür
K, Bir işi yapmak, yönetmek veya bir kurum ve kuruluşu temsil etmek için görevlendirilmiş kişilerden oluşmuş topluluk, heyet, Kurul
K, Bir ülkenin veya bir yerin dış dünya ile olan her türlü bağlantısını kuvvet kullanarak kesme, Kuşatma
K, Sinema ve tiyatroda rol gereği giyilen kıyafet, Kostüm
K, Bazı yerlere girmek veya bazı şeylerden yararlanmak için verilen, kimliği belirten belge, Kart
K, Kahve ve çayda bulunan, hekimlikte kullanılan, kasları, sinirleri uyarıcı, mide salgısını ve metabolik hızı artırıcı etki yapan bir madde, Kafein
K, Soğuk veya sıcak hava vererek kapalı bir yerin havasını değiştiren elektrikli araç, Klima
K, İyice yanarak ateş durumuna gelmiş kömür veya odun parçası, Kor
K, Göz merceğinin saydamlığını yitirerek ağarmasından ileri gelen ve görmeyi engelleyen rahatsızlık, Katarakt
K, Divan edebiyatında din ve devlet büyüklerini övmek amacıyla yazılan, 15-99 beyit arasında değişen, aruz ölçüsüyle kaleme alınan uzun şiir türü, Kaside
K, Bir sayının üçüncü kuvveti, Küp
K, Osmanlı Devleti’nde deniz kuvvetlerinin en büyük askerî ve idari amiri, Kaptanıderya
K, Belirli bir sürenin bir birim olarak kabul edildiği ve telefonda toplam konuşma süresinin kaç birim olduğunu sayısal olarak gösteren araç, Kontör
K, Arasına yağ ve kaymak sürülerek katlanmış yufka ekmeği, Katmer
K, Yağmur, soğuk gibi dış etkilere karşı başa geçirilen, giysiye dikili veya ayrı olarak kullanılan başlık, Kukuleta
K, Bir eğrinin iki noktasını birleştiren doğru parçası, Kiriş
K, Bir şey çekmeye yarar, ucu çengelli demir çubuk, Kanca
K, Pamuktan yapılmış, üzerine sarık sarılan erkek başlığı, Kavuk
K, Başta Tanrı'nın varlığı, birliği, peygamberlik ve ahiret olmak üzere İslamiyet'in ana ilkelerini konu edinen bilim, Kelam
K, Karyolanın yanı başına konulan üstü masa biçimindeki küçük dolap, Komodin
K, Hem ısıtmaya hem de üzerinde veya fırınında yemek pişirmeye yarayan büyük mutfak sobası, Kuzine
K, Yer kabuğunun yapı gereci olan bir veya birkaç mineralden oluşan kütle, Kayaç
K, Bir ülkede veya ülkeler arasında, toplumun veya bir kuruluşun yaşamında görülen güç dönem, Kriz
K, Sanayide küçük ve yuva içine yerleştirilmiş vidaları sökmeye yarayan ince, uzun ağızlı alet, Kargaburnu
K, Aralarında töre, dil ve kültür ortaklığı bulunan, boy ve soy bakımından da birbirine bağlı insan topluluğu, Kavim
K, Bir terzinin veya modaevinin yarattığı her türlü yeni model, Kreasyon
K, Hayvanları tımar etmek için kullanılan dişli araç, Kaşağı
K, Bir sözü gerçek anlamının dışında kullanma sanatı, Kinaye
K, İçine bazı şeyler koymak için huni biçiminde bükülmüş kâğıt kap, Külah
K, İki veya dört tekerlekli, dingili tekerlekle birlikte dönen öküz arabası, Kağnı
K,  Öğrencilere duygu ve düşüncelerini etkili ve düzgün bir biçimde anlatmaları için yaptırılan yazılı veya sözlü çalışma, Kompozisyon
K, Ayrı türden olan ögelerin karıştırılmasıyla oluşmuş, Karma

L, Feshetmek, hükümsüz kılmak, Lağvetmek
L, Barcelona futbol kulübünün altyapısı, La Masia
L, İngiltere'de babadan oğula veya ailenin ilk erkek kişisine geçen veya kral tarafından bağışlanan soyluluk ünvanı, Lord
L, Gürcistan'ın milli para birimi, Lari
L, Takımların belli kurallar çerçevesinde karşılıklı olarak iç ve dış sahalarda karşılaştıkları yarışma grubu, Lig
L, Tavuğun bir kemiğini iki kişinin birer ucundan tutarak kırmasından sonra birinin bir şeyi "aklımda" demeden ötekinden almasıyla yenik sayılması kuralına dayanan bir oyun, Lades
L, Bir kimsenin, kendisine iş verilmeye uygunluk, yaraşırlık durumu, Liyakat
L, Yunan alfabesinin 11. harfi olup fizikte dalga boyu, kimyada radyoaktif bozunma sabiti gibi pek çok bilimsel formuülde kullanılan sembol, Lambda
