letter, question, answer

A, Avustralya ve Yeni Zelanda Kolordusu, Anzak
A, Yeşil renkte tropik bir meyve, Avokado
A, Bir kimsenin emek vermeden sağladığı kazanç, Avanta
A, Duru, sakin havada çıkan kuru soğuk, Ayaz
A, Soylu, köklü bir aileden gelen, seçkin, Asil
A, Halkın alt tabakası, havas karşıtı, Avam
A, Çabuk davranan, çevik, Atik
A, El, yüz veya vücuttaki hastalık yapan mikroorganizmaları kimyasal maddelerle etkisiz hâle getirme veya yok etme işlemi için kullanılan madde, Antiseptik
A, Baharat veya güzel kokular satan kimse veya dükkân, Aktar
A, Evcil büyükbaş hayvanların barındığı kapalı yer, Ahır
A, Dinî inanışa göre, insanın öldükten sonra dirilip sonsuza dek kalacağı ve Tanrı'ya hesap vereceği yer, Ahiret
A, Tavana asılan, şamdanlı, lambalı, cam veya metal süslü aydınlatma aracı, Avize
A, Çevresinde olup bitenlerin farkına varmayan, sezmeyen kimse, gözü bağlı, gafil, Aymaz
A, Belirli bir günün, olayın bir önceki günü veya ona yakın günler, Arife
A, Dünyanın, bir ülkenin, bir bölgenin fiziksel ve siyasal coğrafyası ile ekonomi, tarih vb. konularda toplu bilgi vermek için bir araya getirilmiş coğrafya haritaları derlemesi, Atlas
A, Eski Türk devletlerinde, özellikle Selçuklularda şehzadelerin eğitimi veya bağımsız olarak bir eyaletin yönetimi ile görevli vezir, Atabey
A, Subaylarda üniformaların omuzlarına takılan, rütbenin sembolünü gösteren parça, Apolet
A, Kur'an-ı Kerim'i oluşturan, başı ve sonu belli olan, harf, kelime veya cümleden oluşan Allah'ın sözleri, Ayet
A, Hayat, felsefe veya ahlak hakkında genel kabul görmüş bir gerçeği, derin bir düşünceyi en az kelimeyle, çarpıcı ve akılda kalıcı bir şekilde ifade eden özlü söz, Aforizma
A, Közlenmiş patlıcan, sarımsaklı yoğurt ve kıyma ile yapılan bir yemek türü, Alinazik
A, Aynı uğraş alanındaki insanların, kullanılan ortak, genel dilden ayrı olarak, benimseyip kullandıkları, herkesçe anlaşılamayan, kendilerine özgü sözcük ve deyimlerin yer aldığı özel dil, Argo
A, Elektrik akımı birimi, Amper
A, Yunan klasik devrinde, sitenin yönetim, politika ve ticaret işlerini konuşmak için halkın toplandığı alan, halk meydanı, Agora
A, Baş aşağı dik durma hareketi, Amut
A, Dünyanın en büyük tropikal yağmur ormanı, Amazon
A, Bir hizmet karşılığı sürekli ve düzenli ödenen para, Aidat
A, Çoğunlukla spor yarışmalarında seyircileri coşturan kimse, Amigo
A, Herhangi bir konuyla ilgili durum ve tutumu belirlemek için düzenlenmiş, ayrıntılı ve kapsamlı soru dizisi, Anket
A, Suda çözündüğünde hidrojen iyonları açığa çıkaran, pH değeri 7'den küçük, tatları ekşi, yakıcı ve aşındırıcı özellik gösteren kimyasal maddeler, Asit
A, Yaşadığı ortamdaki insanlar ve kurallarla uyumlu olmayan, kendi düşünce ve eylemleriyle oluşturduğu yaşam biçimine göre hareket eden, Asi
A, Üzüntüden ve sıkıntıdan uzak, rahat ve sakin olan, Asude
A, Güçlükle tutuşan, koku, duman çıkarmadan büyük bir ısı vererek yanan bir taş kömürü türü, Antrasit
A, Gerekli notların unutulmaması için yazıldığı takvimli defter, Ajanda
A, Vücudumuzdaki proteinlerin yapıtaşları, Amino Asit
A, Mecaz anlamda bir olayı, bir durumu yansıtan, göz önünde canlandıran olay, durum, Ayna
A, Şiir ve nesirde uyum sağlamak için söz başlarında ve ortalarında aynı ünsüzün veya aynı hecelerin tekrarlanması, Aliterasyon
A, Genellikle kadınların kullandığı bir seslenme sözü, Ayol
A, Övme, takdir, beğenme vb. duyguları belirtmek için söylenen söz, Aferin
A, Duygu sömürüsü yapma, Ajitasyon
A, Serbest bırakma, Azat
A, Süs taşı olarak kullanılan, mor renkte bir kuvars türü, Ametist
A, Türkçede "ama, fakat, lakin" veya "sadece, yalnızca" anlamlarına gelen, cümleye zaman veya zorunluluk anlamları katabilen işlevsel bir bağlaç ve edat, Ancak
A, Bir el işini veya mekanik bir işi gerçekleştirmek için özel olarak yapılmış nesne, Alet
A, Eski model karbüratörlü kamyonlarda veya otobüslerde vites düşürülürken şanzıman devrinin motora uygulayacağı baskıyı hafifletmek için uygulanan bir yöntem, Ara Gazı/Ara Gaz
A, Bir ülkenin halkına özgü ses perdesi değişiklikleri, vurgulama özelliği, Aksan
A, Güneşin batmasına yakın zamandan gecenin başlamasına kadar geçen zaman dilimi, Akşam
A, "Öyledir, doğru, diyecek yok, inandık" anlamlarında bir onaylama sözü, Amenna
A, Yanan maddelerin veya gazların türlü biçimlerdeki ışıklı uzantısı, Alev
A, Hecelerin uzunluk ve kısalık değerlerine dayanan, Arap edebiyatı kökenli ve Divan edebiyatında yaygın olarak kullanılan bir nazım ölçüsü, Aruz
A, Kırılmış kemiklerin düzgün bir biçimde sarılabilmesi için kullanılan türlü malzemelerden yapılmış destek, Atel
A, Almanca gibi Hint-Avrupa dillerinde isimlerin başına gelen, o ismin belirli/belirsiz, cinsiyet veya sayı özelliklerini belirten kelimeler, Artikel
A, Hollanda'nın başkenti, Amsterdam
A, Yan yana duran veya sürtünen iki cismin molekülleri arasındaki çekiş kuvveti, Adezyon
A, Üç veya daha çok sesin bir arada tınlaması, Akor
A, Sıvanacak, boyanacak yerlere boyadan önce sürülen kat, Astar
A, Giyecek, perde, çanta, ayakkabı vb. şeylerde, kumaşın veya derinin iç tarafına geçirilen ince kat, Astar
A, Karada, denizde, gölde veya akarsularda evcil olmayan hayvanları vurma veya yakalama işi, Av
A, Şiir ya da düzyazı parçalarından seçilerek oluşturulan kitap, Antoloji
A, Bir yapının veya yapı grubunun ortasında kalan üstü açık, duvarla çevrili alan, Avlu
A, Kuşatma, Abluka
A, Kazakistan'ın başkenti, Astana
A, Bazı ülkelerde, hükümdarların, mareşallerin, din adamlarının güç sembolü olarak törenlerde taşıdıkları bir tür ağaç veya metalden değnek, Asa
A, Hasta üzerinde tedavi amacıyla uygulanan kesme ve dikme işlemi, Ameliyat
A, Bir sözcükteki harfleri kullanarak başka bir sözcük kurma, Anagram
A, Tanrı'nın veya doğaüstü varlıkların var olduğuna inanmayan kişi, Ateist
A, Tarım bilimi, Agronomi
A, Giysiyi bütünleyen çanta, kemer, şapka, eldiven, mücevher gibi eşyalara verilen ad, Aksesuar
A, Kağıtları birbirine tutturmak için kullanılan telden yapılmış araç, Ataş
A, Bir kimsenin kendi başından geçen ya da tanık olduğu, üzerinden zaman geçtikten sonra hafızasında kalan önemli olayları, kendi bakış açısıyla anlattığı edebi yazı türü, Anı
A, Edebiyatta yazanı, yapanı, söyleyeni, bilinmeyen, Anonim
A, Canlıların ve nesnelerin bedeninden yayıldığına inanılan, ruh halini, sağlığı ve kişisel enerjiyi yansıtan elektromanyetik bir enerji alanı veya etkileyici atmosfer, Aura
A, Vücutta organ ve dokulara yeterli oksijeni taşıyacak kadar sağlıklı kırmızı kan hücresi veya hemoglobinin bulunmaması, kansızlık, Anemi
A, Tatlı veya tuzlu su hayvanlarının ve su bitkilerinin yapay bir ortamda beslendiği ve yetiştirildiği cam su kabı, Akvaryum
A, Akarsuların taşıyıp yığdıkları balçık, kil gibi çok ince taneli şeylerin kum ve çakılla karışmasıyla oluşan yığın, Alüvyon
A, Yaş, meslek, toplumsal durum vb. bakımından birbirine eşit olanlardan her biri, Akran
A, Herhangi bir cerrahi müdahale öncesi, insan ve hayvanların vücudunun bütününde veya belirli bir kesimindeki duyunun geçici olarak yok edilmesi, Anestezi
A, Türkmenistan'ın başkenti, Aşkabat
A, Trabzon'un köftesiyle ünlü ilçesi, Akçaabat
A, Motorlu araçlarda sarsıntı, sallantı vb. hareketleri en aza indiren, yayların gereksiz hareketlerini gidermeye yarayan düzen, Amortisör
A, Piyangoda bilet değeri kadar kazanılan ikramiye, Amorti
A, Ağrı ve stres gibi sorunları hafifletmek için vücudun belirli stratejik noktalarına ince iğneler batırılmasını içeren alternatif tedavi yöntemi, Akupunktur
A, Bir düşünceyi kişileştirerek ifâde etmek üzere yapılan tasvir, resim veya heykel, Alegori/Allegori
A, Elleri üzerinde veya at, bisiklet, tel üstünde tehlikeli jimnastik hareketleri yapan kimse, cambazlık, Akrobasi
A, Fizik ilminin havanın ve diğer gazların hareketlerini, bu hareketler dolayısıyle ortaya çıkan kuvvetleri, bu kuvvetlerin cisimler üzerindeki etkilerini inceleyen kolu, Aerodinamik
A, İnsan, hayvan ve bitkilerin yapısını, şeklini ve bu yapıyı meydana getiren organların birbiriyle olan ilgisini ve bağlarını inceleyen bilim, Anatomi
A, Uçlarından biri bir yuvanın içine yerleştirilmiş, gömülmüş olan, gömme, Ankastre
A, Haber alıp toplamak ve yaymakla görevli kuruluş, Ajans
A, Bir devlet veya teşkilât hesâbına gizli olarak çalışan, bilgi toplayan kimse, câsus, Ajan
A, Doğrudan doğruya gelip gözü yormaması için ışığı kırıp yumuşatarak aşağıya ve etrâfa yayan lamba siperi, Abajur
A, Futbolda kale direklerinin arkasına takılan örgü perde, Ağ
A, Yaşça büyük erkek kardeş, Abi/Ağabey
A, Hâmilelikte bâzı yemeklerden tiksinmek, bâzılarına karşı da aşırı istek duymak, Aşermek/Aşerme
A, El işleriyle uğraşan zanâat erbâbının toplu olarak çalıştığı yer, Atölye
A, Nişan yüzüğü, Alyans
A, Baba otoritesinin hâkimiyetini kabul eden, Ataerkil
A, Özel mülkiyeti toplumda baskı kaynağı ve devleti onun bir aracı olarak gören, bunların ortadan kalkmasıyla insanın özgürleşeceğini öne süren siyasal öğreti, Anarşizm
A, Cep telefonu, tablet gibi bilişim araçlarında belli işleri yapmak üzere kodlanmış yazılım, uygulama, Aplikasyon
A, Bir atardamarın bir bölgesinde oluşan gevşemeye bağlı ur biçimindeki genişleme, Anevrizma
A, Tanrı'yı veya kutsal bilinen bir kişiyi, bir şeyi tanık göstererek bir olayı doğrulama, yemin, Ant
A, Vericiden boşluğa gönderilen elektromanyetik dalgaları toplayarak alıcıya ileten veya elektromanyetik dalgalar gönderen, çeşitli biçimlerdeki iletken veya iletkenler bütünü aygıt, Anten
A, Genellikle bakterilerle ilgili bir enfeksiyonun neden olduğu ağrılı irin birikintisi, Apse
A, Ekinin, biçildikten sonra tarlada kökün üstünde kalan birkaç santimlik kısmı, saman sapı, Anız
A, Farklı kökenden gelen azınlıkları veya etnik grupları, bunların kültür birikimlerini, kimliklerini baskın doku ve yapı içinde eriterek yok etme, Asimilasyon/Asimile Olmak/Asimile
A, Bir kimseye herhangi bir hususta üstünlük ve yarar sağlayan imkân, Avantaj
A, Teniste eşitliğin bozulması için alınan ilk puan, Avantaj
A, Hakemin bir faul veya ihlal gerçekleştiğinde oyunu hemen durdurmayıp, faul yapılan takımın lehine bir pozisyon doğduysa oyunu devam ettirmesi, Avantaj/Avantaja Bırakma/Avantaja Bırakmak
A, İşsiz güçsüz dolaşan, boş gezen kimse, Avare/Aylak
A, Bir şeyin yapılmasını üstüne alma veya bir işe bağlanma husûsunda verilen söz yahut yapılan anlaşma, taahhüt, Angajman
A, Güneş ışınlarının hem insan hem de bütün canlılar üzerinde etkisini inceleyen bilim dalı, Aktinoloji
A, Aklını gereği gibi kullanamayan, anlama ve kavrama yetenekleri gelişmemiş kimse, Ahmak
A, Saldırgan, Agresif
A, Eski çağlardan kalma eser, Antika
A, İki doğrunun kesişmesinden ortaya çıkan köşenin açıklığı, Açı
A, Sayı boncuğu, Abaküs
A, İleride sakıncalı tarafları çıkabilecek olan şey, Alengir/Alengirli
A, Böbrek üstü bezleri tarafından stres, korku, heyecan veya tehlike anında üretilen ve kana salınan hormon, Adrenalin
A, Akciğerlerde genişlemiş küçük kesecik, Alveol
A, Cıvanın diğer bir mâdenle veya mâdenlerle meydana getirdiği alaşım, Amalgam
A, Negatif yüklü iyon, Anyon
A, Dinin buyruklarını yerine getirmek için yapılan iş, fiil veya hareket, Amel
A, Bir tezi, görüşü veya iddiayı geçerli ya da geçersiz kılmak amacıyla ileri sürülen, kendi içinde tutarlılık gösteren çıkarım, Argüman
A, Gemi, tekne, sandal vb. deniz araçlarının devrilip yan yatması veya ters dönmesi, Alabora
A, Geminin yanaştığı kıyı veya iskeleden hareket ederek uzaklaşması, Avara
A, Bir geminin sahilden veya yanaştığı başka bir gemiden uzaklaşması için verilen komut, Avara
A, Yerde ve gökte yaratılmış olan şeylerin bütünü, kâinat, evren, Alem
A, Rüzgârın hızını ölçen ve yönünü gösteren alet, Anemometre
A, Büyük bir olayın başlı başına bir bütünlük gösteren, ayrı ve küçük bir hikâye olabilecek nitelikteki parçası, Anekdot
A, Telefon cihazının sesi almaya ve konuşmaya yarayan parçası, Ahize
A, Herhangi bir cerrahi müdahale öncesi, insan ve hayvanların vücudunun bütününde veya belirli bir kesimindeki duyunun geçici olarak yok edilmesi, Anestezi
A, İffet sâhibi, nâmuslu, temiz kadın, Afife
A, Herkesin görebileceği yerlere yapıştırılan duvar îlânı, Afiş
A, Açığa vurmak, duyurmak, dile düşürmek, reklam etmek, Afişe/Afişe Etmek
A, Havadaki duman, is, koku vb. yabancı maddeleri emerek dışarı atan aygıt, Aspiratör
A, Herhangi bir kişi veya mekânın bulunduğu şehir, ilçe, mahalle, cadde, sokak, kapı veya daire numarasının belirtildiği bilgi, Adres
A, Arap müziğine ait icra anlayışının Türk müziğine uygulanmasıyla oluşmuş, söz ağırlıklı müzik türü, Arabesk
A, Köyden kente göç eden toplulukların geleneksel yaşam tarzından çağdaş yaşam tarzına geçiş evresini yansıtan kültür, Arabesk
A, Hristiyanlıkta kilise tarafından verilen cemaatten kovma cezası, Aforoz
A, Aynı elementin atomlarının uzayda farklı sayıda veya farklı geometrik dizilimlerle bir araya gelmesi sonucu oluşan, fiziksel ve bazı kimyasal özellikleri birbirinden farklı maddeler, Allotrop
A, Elin parmak uçlarıyla bilek arasındaki iç bölümü, Avuç
A, Hastalık niteliğinde olmamakla birlikte, normalden belirgin durumda sapma gösterme durumu, Anomali
A, Bir dilin seslerini gösteren, belirli bir sıraya göre dizilmiş belli sayıda harfin bütünü, Alfabe
A, Yalan, şişirme haber, Asparagas
A, İslam inancına göre cennet ile cehennem arasındaki yer, Araf
A, Sunumun birkaç satıcı tarafından yapıldığı ve bu az sayıdaki satıcının birbirlerinin üretim kararlarından etkilendiği piyasa türü, Azel
A, Enstrümantal eşlik olmadan, yalnızca insan sesi kullanılarak icra edilen çok sesli veya tek sesli müzik türü, Akapella
A, Türkiye'nin Asya kıtasında bulunan toprağı, Anadolu
A, Bir işteki engelleri yenme kararlılığı, Azim
A, Bir kimseye veya bir topluluğa zorla, ücret vermeden yaptırılan iş, Angarya
A, Açık, ortada, meydanda, herkesin içinde yapılan anlamlarına gelen bir sıfat, Aleni
A, Tüfek, tabanca vb. ateşli silahlarda namlunun en ileri bölümünde bulunan ve nişan alırken gezle birlikte göz ile hedef arasında aynı çizgi üzerine getirilen küçük çıkıntı, Arpacık
A, Göz kapağının kenarında çıkan küçük çıban, Arpacık
A, Bayram, cenaze vb. törenlerde sıralı olarak giden insan topluluğu, Alay
A, Bir albayın komutası altında üç veya dört taburdan oluşan askeri birim, Alay
A, Ses tonu, söz veya mimiklerle bir kimsenin, bir şeyin, bir durumun, gülünç, kusurlu, eksik vb. yönlerini küçümseyerek eğlence konusu yapma, onu aşağılama veya gülünç duruma düşürme, Alay/Alay Etme/Alay Etmek/Alay Geçme/Alay Geçmek/Alaya Alma/Alaya Almak
A, Canlandırma, Animasyon
A, Özellikle tâtil bölgelerindeki otellerde bu işle uğraşan kişiler tarafından düzenlenen, geniş katılımın hedeflendiği eğlence, Animasyon
A, İnce bağırsakla kalın bağırsağın birleşme yerindeki kör bağırsağın ince bir parmak gibi olan son bölümü, Apandis
A, Uyum sağlama, Adaptasyon
A, Ürünü dış etkenlerden koruyan, içine konan ürünleri bir arada tutarak taşıma, depolama, dağıtım, tanıtma, reklam gibi işlemleri kolaylaştıran, kâğıt, mukavva, tahta, plastik vb.nden yapılan malzeme, Ambalaj
A, Para değerinde olan hisse senedi, tahvil gibi kıymetli kâğıtları daha kârlı ve değerli görülenleriyle değiştirme işi, Arbitraj
A, Kundaklı, tetikli yay, Arbalet
A, Bir iş veya durumun sonu veya sonucu, Akıbet
A, Bir ağaca cinsini ıslâh etmek, daha iyi meyve veya çiçek vermesini sağlamak için diğer bir ağaçtan alınan kalem, göz, tomurcuk gibi parçaları ekleme, Aşılama
A, Davranışları ölçülü, olgun kimse, Ağır/Ağırbaşlı
A, Kişiler, gruplar, kurumlar, öğreti veya ideolojiler arasında gizliden gizliye var olan çelişki veya karşıtlık durumu, Antagonizm/Antagonizma
A, Anonim ortaklıklarda sermaye artırımı için yapılan ödeme çağrısı, Apel
A, Geminin, zinciri toplayıp demirini kaldırmaya hazır olması, Apiko
A, Bir kaynağa dayanmayan, hayalî olan, Afaki
A, Bir borca karşılık, hesabı daha sonra görülmek üzere yapılan kısmi ödeme, Akont
A, Karbon ve hidrojen atomlarından oluşan, tekli bağ içeren organik bileşikler, Alkan
A, Yapılarında en az bir tane karbon-karbon çift bağı içeren organik bileşikler, Alken
A, Her türlü mikroptan arınmış, Aseptik
A, Cıva yerine maden bir kutu kullanmak temeline dayanan kadranlı barometre, Aneroit
A, Nijerya'nın başkenti, Abuja
A, Hukuk ve adalet işlerini gören devlet kurumu, Adliye
A, Bir anlaşmazlıkta tarafları uzlaştıran kimse, Aracı/Ara Bulucu
A, Bir kuruluşun yaptığı işi onun adına kazanç karşılığında yürüten daha küçük kuruluş, Acente
A, Deniz veya göl suları ile çevrili kara parçası, Ada
A, Kavşaklarda trafiği düzenleyici, yönlendirici veya ayırıcı olmak üzere bordürle sınırlandırılmış veya yer çizgileriyle belirlenmiş alan, Ada
A, Herhangi bir aracın çeşitli amaçlarla kullanılmasını sağlayan parçaları, Aparat
A, Boksta bükük kolla aşağıdan yukarıya doğru çeneye atılan yumruk, Aparkat
A, Vücudun sağlıklı kalması için hasarlı, yaşlı veya gereksiz hücrelerin genetik olarak programlanmış, kontrollü ve sessiz bir şekilde intihar etmesi, Apoptpz/Apoptozis
A, Boks sporunda dövüşemeyecek duruma gelen boksörün karşılaşmayı yarıda bırakması, Abandone/Abandone OLma/Abandone Olmak
A, Görüş ve düşüncelerini eyleme dönüştürerek gösteren, savunan kimse, eylemci, Aktivist
A, Hastanın, hastalığı ve çevresi hakkında verdiği bilgi, Anamnez/Anamnezi
A, Avusturya'da imparator ailesi prenslerine verilen ünvan, Arşidük
A, Belge veya yazıların saklandığı yer, Arşiv
A, Bilim, kültür, sanat, günlük yaşam vb. ile ilgili her türlü bilginin yer aldığı, belli bir yönteme göre genellikle alfabetik olarak düzenlenen, çoğunlukla birkaç ciltten oluşan kitap, Ansiklopedi
A, Atomlarının düzenlenişleri herhangi bir simetri sistemine uymadığı için bir kristal yapıya sahip olmayan cam, opal gibi katı maddelerin iç yapısını belirten terim, Amorf
A, Kent içinde ulaşımı sağlayan otobüslerde para yerine geçen bilet veya kart, Abonman
A, Bir satıcı veya kamu kuruluşu ile alıcılar arasında yapılan anlaşma, Abonman
A, Bankaların ve diğer mali kurumların, müşterileri lehine muamelelerle ilgili kredi hesabı açtırmak üzere şubelerine gönderdikleri yazı, Akreditif
A, Sulu boya resim, Akvarel
A, Kendisinden ve 1'den başka böleni olmayan, 1'den büyük sayı, Asal/Asal Sayı/Asal Sayılar
A, Bir kullanıcının dijital dünyada kendini temsil etmek için kullandığı grafiksel, görsel veya 3D model karakter, Avatar
A, İnsanın kökenini, evrimini, biyolojik özelliklerini, toplumsal ve kültürel yönlerini inceleyen bilim, Antropoloji
A, Bir yapıda içeri geçilen yer, Antre
A, Faizin işlemesine son vermek için bir tahvilin birden ödenmesi, Amortisman
A, Üzerine yapı yapılmak için ayrılmış yer, Arsa
A, Bulunulan yerin yüksekliğini gösteren aygıt, Altimetre
A, Oynar eklemlerde oynaklığın kalmamasıyla eklemin işlemez duruma gelmesi, Ankiloz
A, Çok ince zerrelerin bir gaz içinde dağılması sonucunda meydana gelen kolloit yapıdaki madde, Aerosol

B, Bir bilgisayarda verileri geçici saklayan donanım, Bellek
B, Dana veya sığırın göğüs eti veya döş bölgesi, Brisket
B, Sacda pişirilmiş yuvarlak ekmek, Bazlama
B, Düz veya kıvrımlı her çeşit yumuşak kumaş, slikon vb. malzemeden yapılan başlık, Bone
B, Müzik eşliğinde içki içilen, yemek yenilen bir tür lokanta, Bistro
B, Bir sınıflama ve dereceleme yapabilmek için belirlenmiş olan ölçü sistemi, Barem
B, Dalın gövde içindeki başlangıç yeri olan ve tahtalarda görülen, yuvarlak ve koyuca renkte sert bölüm, Budak
B, Şişman, gürbüz iri cüsseli çocuk, Balaban
B, Hayvanların, arka bacaklarının gövdeye bitişik olan dolgun, etli bölümü, But
B, Başıboş, serseri kimse, Berduş
B, Kız kardeş, Bacı
B, Atom numarası 5 olan, bileşikleri sabun, cam, porselen yapımı gibi çeşitli yerlerde kullanılan element, Bor
B, Şehirde yaşayan, üretim araçlarını ellerinde bulunduran ve kendi başına üretim ve kazanç yollarında çalışarak kendine geniş bir geçim sağlayan kimse, Burjuva
B, Yeryüzündeki herhangi bir noktanın meridyen çemberiyle başlangıç olarak alınan Greenwich Gözlemevi'nin meridyen çemberi arasındaki açı değeri, meridyen, Boylam
B, Eşleri kardeş olan erkeklerin birbirine göre durumu, Bacanak
B, İslam dininde Hz. Muhammed zamanından sonra ortaya çıkan değişik yargılar ve ilkeler, Bidat
B, Amerika'da yaşayan bir cins hörgüçlü yaban öküzü, Bizon
B, Bitki bilimi, Botanik
B, Sulu, cıvık hamur, Bulamaç
B, İki direkli, seren yelkenli, birkaç top taşıyan gemi, Brik
B, Çoğunlukla mor kadife üzerine sırma ile kabartma dal, yaprak ve çiçek işlenmiş, uzun kollu, boyu yere kadar uzanan, önü açık giysi, Bindallı
B, Enine göre boyu kısa ve tıknaz, Bodur
B, Bir işe, bir duruma, bir harekete sonucunun ne olacağını düşünmeden girişmek, Balıklama/Balıklama Atlamak/Balıklama Atlama
B, Siyasal anlamda Avrupa ve Kuzey Amerika, Batı
B, Herkesçe kullanılan, anlaşılan, Banal
B, Jeolojide herhangi bir aşınma sürecinde veya taşıma işi yapılırken alüvyonlu maddelerin bırakılması, Birikim
B, Öpücük, Buse
B, Su biriktirmek için akan suyun önüne yapılan set, Bent
B, Bir şiirdeki dörtlüklerin her biri, Bent
B, Bir konuda hazırlıksız konuşabilme yeteneği, Bedahet
B, Arpa, darı, mısır, buğday vb. tahılların hamurunun ekşitilmesiyle yapılan koyuca, tatlı veya mayhoş içecek, Boza
B, Yolcu taşıtlarında yüklerin konulduğu yer, Bagaj
B, Kadınların saçlarını kıvırmak için kullandıkları, metal, sünger veya plastikten, boru biçiminde küçük araç, Bigudi
B, Isı etkisiyle sıvıların ve bazı katıların dönüştükleri gaz durumu, Buhar
B, Değerli olmayan maden veya taşlardan yapılmış takı, süs eşyası, Bijuteri
B, Banyodan çıkarken kurulanmak için kullanılan, kollu, önden açık, havludan yapılmış giyecek, Bornoz
B, Ateşli silahlarda barut gazının basıncı ile fırlayıp hedefe varıncaya kadar merminin havadaki hareketini inceleyen bilim, Balistik
B, Malın değişik özelliklerini ve fiyatını belirten, elektronik aygıtların okuyabileceği biçimde düzenlenmiş etiket, Barkod
B, Kötü durum, içinden çıkılmaz iş, Batak
B, Bir işte tutulması gereken yolu kestirememek, ne yapacağını bilememek, kararsız olmak, Bocalamak/Bocalama
B, Birim yüzeye dik olarak etki eden kuvvetin büyüklüğü, Basınç
B, Kandaki zararlı maddeleri süzüp idrar olarak salan, omurganın sağ ve sol yanında bulunan organ, Böbrek
B, Ortadan kaldırılmış, Bertaraf
B, İnsanoğlu ile ilgili, Beşeri
B, Türkiye'de kurulan en eski spor kulübü, Beşiktaş
B, Genellikle oturma alanı niteliğinde olan, şehir merkezinden uzakta veya sınırlarına yakın yerlerde bulunan şehir yöresi, Banliyö
B, Kırgızistan'ın başkenti, Bişkek
B, Yaşatmak ve geliştirmek için gereken besinleri yedirip içirme işi, Besi
B, Danslı ve özel giysili gece eğlencesi, Balo
B, Doğa içinde yer alan, tek katlı veya asma katlı, ahşap malzemeden yapılan küçük, sade ve geniş verandalı tatil evi, Bungalov
B, Sıcak su bulunan bir kaba, başka bir kap oturtarak narin besinleri pişirme usulü, Benmari
B, Su altı derinliklerini ölçmek için kullanılan cihaz, Batimetre
B, Devletin, kuruluşların, aile ve bireylerin gelecekteki belirli bir süre için tasarladığı gelir ve giderlerin tümü, Bütçe
B, Ağ günlüğü, Blog
B, Hırvatistan, Sırbistan, Karadağ, Kosova, Slovenya, Arnavutluk, Makedonya, Bosna-Hersek, Bulgaristan, Romanya, Yunanistan ve Trakya'yı içine alan bölge, Balkanlar/Balkan
B, Kur'an-ı Kerim'in en uzun suresi, Bakara
B, Dünya üzerinde benzer iklim koşullarına, coğrafi yapıya, bitki örtüsüne ve hayvan topluluklarına sahip, geniş alanları kaplayan büyük ekosistem tipi, Biyom
B, Buğday veya mısır gibi tahıl bitkilerinin sapının tane taşıyan uç kısmı, Başak
B, Geçişi engellemek, güvenliği sağlamak veya iki alanı birbirinden ayırmak için kurulan fiziksel engel, Bariyer
B, Yaya yolu ayrılmamış karayolunda, taşıt yolu kenarı ile şev başı veya hendek iç üst kenarı arasında kalan ve olağan olarak yayaların ve hayvanların kullanacağı, zorunlu hallerde de araçların faydalanabileceği kısım, Banket
B, Hindistan’ın kast teşkîlâtına dayalı sosyal ve dînî rejimi, Brahmanizm/Brahmanlık
B, Eli açık, cömert, Bonkör
B, Boyu bele kadar kısa, kolsuz cepken biçimindeki kadın ceketi, Bolero
B, Romanya'nın başkenti, Bükreş
B, Rönesans’tan sonra İtalya’da ve Avrupa’nın özellikle Katolik memleketlerinde gelişen, kıvrık hatlara ve süslere yer veren bir mîmârî ve süsleme üslûbu, Barok
