letter, question, answer
K, Yaprakların her iki yüzünde bulunan ve suyu sızdırmadığı için bitkinin kurumasına engel olan ince zar, Kütikül
K, Susam tanesi, Küncü
K, Osmanlı döneminde mahkemelerin en yetkilisi, Kazasker
K, İlmiye sınıfının yüksek derecesinde bulunan devlet görevlisi, Kazasker
K, İçinde, görüntü ve seslerin kaydedildiği, gerektiğinde yeniden kullanılmasını sağlayan bir manyetik şeridin bulunduğu kutu, Kaset
K, Yayımlanan mevzuatın derlenip toplanması ve mevzuatta yapılan değişikliklerin ilgili ana mevzuata işlenmesi, Kodifikasyon
K, Kalbi taç şeklinde kuşatıp besleyen damarlar, Koroner
K, Piyano, klavsen, org gibi mûsikî âletlerinde tellerden ses çıkarmak için, daktilo, bilgisayar gibi âlet ve cihazlarda isteğe göre çalışmasını sağlamak üzere parmakla basılarak kumanda edilen tuşların bulunduğu kısım, Klavye
K, Dağcılık, tırmanış, endüstriyel iş güvenliği ve kampçılık gibi alanlarda halatları, yükleri veya emniyet sistemlerini hızlı ve güvenli bir şekilde birbirine bağlamaya yarayan, yaylı bir kapağa sahip, metal veya alüminyumdan üretilen yüksek dayanımlı halka şeklindeki bağlantı ekipmanı, Karabina
K, Hareket eden nesnelerle belli nicelikte ısının taşınması olayı, Konveksiyon
K, Su tabakasına varılıncaya kadar dâire şeklinde kazılıp çevresine duvar örülen ve içindeki su kova veya tulumba ile alınan derin çukur, Kuyu
K, Koyun yavrusu, Kuzu
K, Duvar ve tavan ara kesitleriyle tavan göbeklerinde süsleme amacıyla kullanılan sertleştirilmiş alçı, Kartonpiyer
K, Bir otomobilin arkasına takılan veya hem taşıt hem konut olarak kullanılan üstü kapalı, ev özelliğinde araç, Karavana
K, Atış taliminde hedef tahtasını bile vuramama, Karavana
K, Sanatçıların müzik eserlerini bir topluluk önünde çalması veya söylemesi, Konser/Konser Verme/Konser Vermek
K, Isı ile sterilize edilerek uzun zaman saklanabilecek biçimde kutulanmış yiyecek, Konserve
K, Müzik, tiyatro ve bale öğretiminin yapıldığı okul, Konservatuvar
K, Mısır'ın başkenti, Kahire

L, Feshetmek, hükümsüz kılmak, Lağvetmek/Lağvetme
L, Barcelona futbol kulübünün altyapısına verilen isim, La Masia
L, İngiltere'de babadan oğula veya ailenin ilk erkek kişisine geçen veya kral tarafından bağışlanan soyluluk ünvanı, Lord
L, Gürcistan'ın milli para birimi, Lari
L, Takımların belli kurallar çerçevesinde karşılıklı olarak iç ve dış sahalarda karşılaştıkları yarışma grubu, Lig
L, Tavuğun bir kemiğini iki kişinin birer ucundan tutarak kırmasından sonra birinin bir şeyi "aklımda" demeden ötekinden almasıyla yenik sayılması kuralına dayanan bir oyun, Lades
L, Bir kimsenin, kendisine iş verilmeye uygunluk, yaraşırlık durumu, Liyakat
L, Yunan alfabesinin 11. harfi olup fizikte dalga boyu, kimyada radyoaktif bozunma sabiti gibi pek çok bilimsel formuülde kullanılan sembol, Lambda
L, İnce, geniş makarna yapraklarının arasına beşamel sos, bolonez sos ve peynir konularak kat kat dizilmesiyle hazırlanan, fırınlanmış köklü bir İtalyan hamur işi yemeği, Lazanya
L, Nişastalı tanelerin, su ile kaynatılarak bulamaç kıvamına getirilmiş durum, Lapa
L, Hayvan ve bitki dokularının eter, benzen, kloroform vb. yağ çözücülerinde eriyen bölümü, Lipit
L, Mecazi anlamda herhangi bir düzenin iyi işlemez olması, gevşemek, bozulmak, Laçkalaşmak
L, Deri ve saç bakımında kullanılan alkollü veya alkolsüz, kokulu sıvı, Losyon
L, Gemilerin barınmalarına, yük alıp boşaltmalarına, yolcu indirip bindirmelerine yarayan doğal veya yapay sığınak, Liman
L, Nazik, hoş, ince espri, Latife
L, Bozulmuş veya bozulmaya yüz tutmuş olan dostluk ilişkisi, Limoni
L, Nitelikleri, özü, hareketleri, davranışlarıyla bir şeyi elde etmeye hak kazanmış olan, Layık
L, Belli bir iş kolunda usta, kalfa ve çırakları içine alan esnaf kuruluşu, Lonca
L, Mecaz anlamda ara vermeden söylenilen saçma sapan söz dizisi, Laklak
L, Bir sporcunun resmî yarışmalara katılabilmesi için spor federasyonunun kendisine verdiği kayıt fişi veya kimlik kartı, Lisans
L, Genellikle dört yıl süren üniversite veya yüksekokul öğrenimi, Lisans
L, Çamgillerden, 50-60 metre yüksekliğinde, düz gövdeli, kozalağı aşağıya doğru sarkık, kerestesi ve reçinesi değerli, çam türüne çok yakın bir orman ağacı, Ladin
L, Kamaralarla alt güverteleri aydınlatmak için bordalardan ve güvertelerden açılan yuvarlak pencere, Lomboz
L, Tanrı'nın merhametinden yoksun olma, Lanet
L, Belirli bir konu veya bilim dalında yayınlanmış kitap, makale, tez ve akademik çalışmaların tümünü ifade eden terim, Literatür
L, Taş bilimi, Litoloji
L, Çalgı onaran veya yapıp satan kimse, Lutiye
L, Şehzadelerin özel eğitmenleri, Lala
L, Ayakkabı boyama, Lostra
L, Eti ve karnı beyaz, sırtı koyu, hafif pullu, kemikli bir balık, Lüfer
L, Bir işlem sonrası, metal yüzeyleri su ile yıkama, Lavaj
L, Doğrusal, Lineer
L, Sıradan olmayıp pahalı zevkleri içinde barındıran, Lüks
L, Akyuvar içeren, kan plazmasına benzeyen renksiz sıvı, Lenf
L, Önem verilen, sayılan birinden gelen iyilik, kayra, Lütuf
L, Bir kişi veya grubun, paylaşımları nedeniyle internet kullanıcıları tarafından topluca ve acımasızca eleştirilmesi, aşağılanması veya hedef gösterilmesi, Linç
L, Tiyatro, sinema vb. eğlence yerlerinde veya parlamento salonlarında özel bölme, Loca
L, Bir fonksiyonun argümanı bir değere yaklaştıkça yaklaştığı değer, Limit
L, Böcekler ve bazı omurgasız canlıların yumurtadan çıktıktan sonra ergin hale gelene kadar geçirdikleri, genellikle kurtçuğa benzedikleri evre, Larva
L, Birinden bir şey isterken "dilerim, rica ederim" anlamında kullanılan bir zarf, Lütfen
L, Bir kimse veya âileye herhangi bir münâsebetle asıl adından başka sonradan takılan ad, Lakap
L, Masa Futbolu, Langırt
L, Kavrulmuş nohut, Leblebi
L, Mevki, konum, Lokasyon
L, Yanardağların püskürme sırasında fırlattığı, sonradan katılaşan, kızgın bir ateş seli hâlinde akan erimiş madde, Lav
L, Porselen veya emayeden yapılmış, üzerinde sıcak ve soğuk su muslukları bulunan, el, yüz vb. yıkamaya yarayan düzenek, Lavabo
L, Kurum, kuruluş veya iş yerindeki çalışanlara parasız veya az bir kira karşılığında oturmaları için tahsis edilen konut, Lojman
L, Harfleri dizen ve satırları tek parça hâlinde döken dizgi makinesi, Linotip
L, Hint-Avrupa dil ailesinin Baltık-Slav dilleri koluna giren ve Polonya’da konuşulan dil, Lehçe
L, Bir dilin târihî ve siyâsî sebeplerle veya bölge farklılığından dolayı ses yapısı ve söz dizimi bakımından ayrılan kolu, Lehçe
L, Birleştirilecek mâden parçalarını yan yana getirip aralarına, ergime noktası bu mâdenlerden daha düşük bir alaşım veya mâden koyup akkor derecesinde ısıtmak sûretiyle yapılan çok dayanıklı kaynak, Lehim
L, Yer kabuğunu oluşturan parçalardan her biri, Levha
L, Gözün saydam tabakasının üzerine doğrudan uygulanan, görmeyi düzeltici mercek, Lens
L, Ağza bir defada alınıp götürülen yiyecek parçası, Lokma
L, Tibet ve Moğolistan’da Buda râhiplerine verilen isim, Lama
L, Sindirim enzimlerini içeren ve vücutta biriken zararlı maddelerle besinlerin parçalanmasını sağlayan, iç kısmı zarla çevrili organel, Lizozom
L, Avlanan balıkları canlı olarak saklamak için ağzı içine doğru konik örülmüş sepet, Livar
L, Karşılıklı anlayış, faaliyet ve amaç birliğini sağlamak için, istihbarat teşkilatları veya askerî birlikler arasında sürdürülen haberleşme ve irtibat, Liyezon
L, Tren vagonlarını çeken, tekerlekli, buharlı, elektrikli, termik motorlu veya sıkıştırılmış havalı makine, Lokomotif
L, Yaşama işlevlerinin ve bilincin çok zayıfladığı, çok derin ve sürekli patolojik uyku durumu, Letarji
L, Bir mantarla bir su yosununun ortak yaşamasıyla ortaya çıkan bitkilerin genel adı, Liken
L, Özellikle Tanzimat sonrasında büyük liman kentlerinde yoğunlaşan ve ticaretle uğraşan Hristiyanlara verilen ad, Levanten
L, Bir yapının kapısından içeri girildiğinde görülen ilk boşluk, Lobi
L, Otel, tiyatro vb. yerlerde girişe yakın geniş yer, Lobi
L, Bir organın yuvarlak ve birbirinden ayrılmış parçalarından her biri, Lop
L, Doku bozukluğu, Lezyon
L, Ağır yükleri kaldırmak, araçlara yüklemek ve boşaltmak için kullanılan makine, Lift
L, Teniste topa arkadan öne, yukarıdan aşağıya doğru vurma, Lift
L, Portekiz'in başkenti, Lizbon
L, Sarı renkli, kokulu, kabuğundan sıkma veya damıtma yoluyle esans elde edilen, C vitamini bakımından zengin, suyu ekşi, yumurta biçimindeki meyve, Limon
L, Birimi yüz kuruş değerinde Türkiye'nin para birimi, Lira
L, Yabancı uyruklu sporcu, Lejyoner
L, Eski Romalılarda piyade ve süvarinin oluşturduğu askerî birlik, Lejyon
L, Ad veya numara çekilerek oynanan şans oyunlarının genel adı, Lotarya
L, ir üssel eşitlikte taban ve sonuç belirliyken üssün bulunması yolu, Logaritma

M, Hafif makineli tüfek, Mirtalyöz
M, Dört dizeli bentlerden oluşan divan şiiri, Murabba
M, Eğlendirici, güldürücü kişi, Maskara
M, I. Dünya Savaşı’ndan sonra bazı az gelişmiş ülkelerin, bağımsızlığa hazır hâle gelene kadar Milletler Cemiyeti adına büyük devletler tarafından yönetilmesi yetkisi, Manda
M, Başkalaşma, Metamorfoz
M, Sahip olunan mal veya paralar, Maddiyat
M, Para, kazanç karşılığı olarak kötü, uygunsuz işler çeviren kimse, Mürtekip
M, Gösteri amacıyla veya bir olaya dikkati çekmek için genellikle açık yerlerde yapılan toplantı, Miting
M, Fabrika yapımı her türlü kumaş, bez vb. dokuma, Manifatura
M, Bir tarafına kauçuk veya yağlı boya sürülerek su geçirmeyecek duruma getirilen kalın bez, Muşamba
M, Yağmur sularını kanalizasyon şebekesine çekmek için kullanılan üzeri parmaklıklı demirle kapatılmış delik, Mazgal
M, İçi yumuşak bir malzeme ile doldurularak dikilen, oturmaya, yaslanmaya yarar şilte, Minder
M, Hamur kıvamına getirilmiş madde, Macun
M, Nane kokusu, Mentol
M, Bir kurum veya kuruluşu yöneten kimse, Müdür
M, Tekrarlama sonucu kazanılan yatkınlık, alışkanlık, Meleke
M, Büyükbaş ve küçükbaş hayvanların süt elde etmek amacıyla beslenip barındırıldığı, süt ve süt ürünlerinin üretildiği çiftlik, Mandıra
M, Açık artırma ile satış yapılan yer, Mezat
M, Dinî kurallara uygun olarak kesilmemiş olan hayvan, Murdar
M, Fransızcadan dilimize giren hiç değiştirmeden anlamında kullanılan bir zarf, Motamot
M, Yer kabuğunun bazı bölgelerinde çeşitli iç ve dış doğal etkenlerle oluşan, ekonomik yönden değer taşıyan mineral, Maden
M, Siyasi otoritenin genellikle miras yolu ile bir kişinin üzerinde toplandığı devlet düzeni, Monarşi
M, Bir şeyin bal mumu, alçı vb. bir madde ile kalıbını çıkarmak için yapılan işlemlerin bütünü, Mulaj
M, Rusya'nın başkenti, Moskova
M, Bakırdan yapılmış, iki buçuk para değerinde sikke, Mangır
M, Alevilikte özel bir dinî tören ile atanan ve kişinin hem dünyada hem de ahirette kardeşi ve yoldaşı kabul edilen kimse, Musahip
M, Bağnaz, Mutaassıp
M, Ele geçirilmiş, zapt edilmiş, Mazbut
M, Savaşçıların veya itfaiyecilerin başlarına giydikleri demir başlık, Miğfer
M, Eski Yunan felsefesinde bölünmez birlik, Monat
M, Bir kişi, grup, siyasi parti veya sanat akımının inançlarını, niyetlerini ve amaçlarını kamuoyuna açıkça ilan eden yazılı bildiri veya beyanname, Manifesto
M, Bir mücadelede üstünlük elde etmiş, utkulu, Muzaffer
M, Dikkat çekmek, toplumda odak noktası hâline gelmek için yalana başvuran, bir noktadan sonra kontrolü kaybederek söylediği yalana kendisi de inanmaya başlayan kimse, Mitomani
M, Kısa ökçeli, bağsız ayakkabı, Makosen
M, Atların eğitildiği, binicilik derslerinin yapıldığı ve antrenmanların gerçekleştirildiği, özel bir zeminle kaplı açık veya kapalı eğitim alanı, Manej
M, Yapılan bir iyiliğe karşı kendini borçlu sayma, gönül borcu, Minnet
M, Hücrede enerji üretiminden sorumlu olan ve oksijenli solunumun gerçekleştiği organel, Mitokondri
M, Rendelenen veya ezilen meyvelerin şekerle kaynatılıp püre kıvamına getirilmesiyle yapılan, genellikle kahvaltılarda yenilen bir tatlı, Marmelat
M, Boyna zincirle takılan, genellikle değerli metalden yapılmış, içine küçük resim gibi şeyler konulan, türlü biçimde süs eşyası, Madalyon
M, Birbirine bağlı gruplar halindeki atomların oluşturduğu kimyasal bileşiklerin en küçük temel yapısına verilen ad, Molekül
M, Kalın oklava, Merdane
M, Genellikle metalden yapılan, dört parmağın içinden geçmesiyle avuç içine yerleştirilen ve yumruk atıldığında darbe etkisini ciddi oranda artıran, yaralayıcı bir savunma aracı, Muşta
M, Olumlu, pozitif, Müspet
M, -den sonra anlamı vermek için kullanılan Arapça kökenli bir zarf, Müteakip
M, Birbirine uyan, karşılıklı olarak anlaşmaya varan, birbiriyle uzlaşan, Mutabık
M, Cami, mescit vb. yerlerde Kâbe yönünü gösteren, duvarda bulunan ve imama ayrılmış olan oyuk, Mihrap
M, Boğa güreşçisi, Matador
M, Bir makine, cihaz veya mobilyanın parçalarını yerli yerine takma, Montaj/Monte/Monte Etme/Monte Etmek
M, Bir yazıyı biçim, anlatım ve noktalama özellikleriyle oluşturan kelimelerin bütünü, Metin
M, El masajı, ölü derinin temizlenmesi, tırnaklara şekil verme, tırnak törpüleme gibi işleri içeren el bakımı, Manikür
M, Japonlara özgü çizgi roman, Manga
M, 10 kişilik asker birliği, Manga
M, Özür, bahane, Mazeret
M, Almanya’nın ve Finlandiya’nın eski para birimlerinin adı, Mark
M, Kimi takım oyunlarında, karşı takım oyuncusunun eylemine ayakla ya da vücut hareketiyle engel olma, Markaj
M, Yassı solungaçlı, yumuşakçalardan, kabukları birbirine eşit, denizlerin kayalık yerlerinde kümeler durumunda yaşayan eti yenir bir hayvan, Midye
M, Hesap işlerinin yürütüldüğü yer, Muhasebe
M, Tadı az şekerli olmakla birlikte daha çok ekşi olan, Mayhoş
M, Birinin toprağını işleyerek yalnızca ürüne ortak olan kimse, Maraba
M, İdrar torbası, Mesane
M, Hareketli olan, taşınabilir olan, Mobil
M, Bir fitilin etrafına erimiş bal mumu, içyağı, stearik asit veya parafin dökülerek genellikle silindir biçiminde dondurulan ince, uzun aydınlatma aracı, Mum
M, Yeraltında veya yapıların alt katlarında genellikle depo amaçlı kullanılan kapalı ve genelde serin ortam, Mahzen
M, Yan yana gelerek bir bezeme işini oluşturan ve kendi başlarına birer birlik olan ögelerden her biri, Motif
M, Osmanlı Mebusan Meclisi tarafından 28 Ocak 1920'de kabul edilen ve Türk Kurtuluş Savaşı'nın hedeflerini, vatanın bölünmez bütünlüğünü ve bağımsızlık şartlarını belirleyen 6 maddelik belge, Misakımıilli/Misak-ı Milli
M, Gemilerde, ambarlara ve makine bölümüne hava vermek için güverteye açılan baca, Manika
M, Normal sıcaklıkta doğada katı durumda birtakım maddelerle karışık veya birleşik olarak bulunan veya kimyasal yollarla elde edilen inorganik madde, Mineral
M, Hz. İsa'nın doğduğu gün, Milat
M, Afrika'nın Mısır dışındaki kuzey ülkeleri, Mağrip
M, Bağımlı, tutulmuş, vurgun anlamlarında bir sıfat, Müptela
M, Kullanış yönünden başka bir yapı ile bağlantısı olmayan, Müstakil
M, Birine, ölen bir yakınından kalan mal mülk, para veya servet, Miras
M, Bir kavramı, durumu veya nesneyi, aralarındaki benzerlikten yararlanarak başka bir kavram veya nesne ile anlatma sanatı, Metafor
M, Mecazi anlamda futbol topu, Meşin Yuvarlak
M, Allah tarafından insanların rızkını dağıtmakla ve doğa olaylarının gerçekleşmesini sağlamakla görevlendirilen melek, Mikail
M, Kırmızı ile mavinin karışımından ortaya çıkan renk, Mor
M, Kedi sesi, Miyav
M, Vücut yüzeyinde el, elektrik, su aracılığıyla çeşitli işlemler yapma biçiminde, iyileştirme, rahatlama ve bakım yöntemi, Masaj
M, Deniz, göl, havuz vb. yerlere girerken veya güneşlenirken giyilen, tek parçadan oluşan giysi, Mayo
M, Akdeniz dolaylarında yaygın olan, bodur ağaç ve çalılardan oluşan bitki örtüsü, Maki
M, Bir dinin görüş, yorum ve anlayış ayrılıkları sebebiyle ortaya çıkan kollarından her biri, Mezhep
M, Hava koşullarında meydana gelen değişmeleri, iklim türlerini araştırıp hava durumu tahminlerinde bulunan bilim dalı, Meteoroloji
M, Zihni sakinleştirmek, odaklanmayı artırmak ve iç huzura ulaşmak amacıyla yapılan, derin düşünme ve farkındalık geliştirme tekniklerinin bütünü, Meditasyon
M, Gök taşı, Meteor
M, Yüzü gizlemek, korumak veya farklı bir kimliğe bürünmek için kullanılan, yüzün tamamını veya bir kısmını örten araç, Maske
M, Dişlerin taç kısmını kaplayan beyaz ve sert doku, Mine
M, Bir işlem veya olayın gerçek dünyada gerçekleşmiş olsa bile taşıdığı şartlar gereği hukuken hiç gerçekleşmemesi, Mutlak Butlan
M, Devlete, kamuya, gerçek ya da tüzel kişilere ait olan taşınmaz mal, Mülk
M, Toplumda kabul gören normlara, geleneklere ve değerlere uymayan, farklı bir yaşam tarzı ve bakış açısına sahip olan kişi, Marjinal
M, Genellikle sanat, eğlence ve spor dünyasında tanınmış kişilerle ilgili haber, Magazin
M, Ucunda alev çıkarabilen yanıcı bir madde bulunan, aydınlatmaya yarayan değnek, Meşale
M, Geleneksel olarak yayılan veya toplumun hayal gücü etkisiyle biçim değiştiren alegorik bir anlatımı olan halk hikâyesi, Mit/Mitos
M, Japon imparatorlarına verilen ünvan, Mikado
M, Bir kişi ya da kuruma herhangi bir konu üzerinden deneyimlerini ve bilgilerini aktaran kişi, Mentör
M, Toprak ve kireçle karışık taş kırıntıları, yapı döküntüsü, inşaat atığı, Moloz
M, Gözle görülüp elle tutulamayan, madde ve cisimle ilgisi bulunmayan, Manevi
M, Kamu veya özel kurumlarda işlerin yasalara ve kurallara uygunluğunu denetleyen, inceleyen ve bu durumu raporlayan yetkili kişi, Müfettiş
M, Sırt üstü yatarak dizlerin bükülü olduğu pozisyonda, karın kaslarını kullanarak üst vücudun yerden kaldırılıp dizlere doğru yaklaştırıldığı karın kası egzersizi, Mekik
M, Şair ve yazarların eserlerinde kendi adları yerine kullandıkları takma ad, Mahlas
M, Taklitler yaparak, hoş hikayeler anlatarak halkı eğlendiren sanatçı, Meddah
M, Camilerde müezzinin ezan okuduğu, sela verdiği, şerefesi olan yapı, Minare
M, Diz altından topuğa kadar uzanan, öbür kıyafetlerin üstüne giyilen, kalın kumaştan, kışlık kadın giysisi, Manto
M, Binaları soğuğa veya sıcağa karşı koruma amacıyla dış yüzeyini özel malzemeyle kaplama, Mantolama
M, İçinde dinsel veya büyüleyici bir gücün saklı olduğu sanılan, taşıyanı, takanı veya sahip olanı zararlı etkilerden koruyup iyilik getirdiğine inanılan yazılı kâğıt, Muska
M, Canlılarda çevrenin etkisiyle meydana gelen ve kalıtsal olmayan özellik, Modifikasyon
M, Bir aracın estetik, performans veya işlevsellik yönünden orijinalinden farklılaştırılması süreci, Modifiye
M, Genlerde veya kromozomlarda oluşan hasara bağlı olarak ortaya çıkan ve sonraki kuşağa aktarılabilen kalıcı hücresel değişiklik, Mutasyon
M, Devlet hizmetinde aylıkla çalışan kimse, Memur
M, Basımevi, Matbaa
M, Evlenmemiş genç Fransız kadınlarına hitap etmek için kullanılan bir ünvan, Matmazel
M, Herhangi bir konuda bilgi vermek, bir görüşü savunmak veya bir tezi bilimsel verilerle kanıtlamak amacıyla yazılan nesnel ve açıklayıcı yazı türü, Makale
M, İş yerinde bir kişiye sistematik olarak yapılan psikolojik baskı, yıldırma veya dışlama, Mobbing
M, Devlet kademesinde yüksek ve önemli memuriyet, Makam
M, Benzetme ilgisi bulunmaksızın, neden sonuç gibi türlü ilişkilerle bir sözcüğün başka bir sözcük yerinde kullanılması sanatı, Mecazımürsel
M, Bir kelimeyi veya kavramı kabul edilenin dışında başka anlamlara gelecek biçimde kullanma, Mecaz
M, Mantar bilimi, Mikoloji
M, "Değil mi ki, -diği için, -diğine göre" anlamlarında sebep göstermek için, başına getirildiği cümleyi daha sonraki cümleye bağlayan bir bağlaç, Madem/Mademki
M, Bağırsakları çalıştırıp temizleyen, dışkının kolaylıkla dışarı atılmasını sağlayan ilaç, Müshil
M, Dini inanışlarda Allah'ın nurdan yarattığı, gözle görülmeyen, yemeyen, içmeyen, cinsiyeti olmayan ve emirlerine tam itaat eden ruhani varlık, Melek
M, Çeşitli güçlükler, tehlikeler karşısında inanç ve ahlâkî değerlere bağlılıktan doğan dayanma gücü, Moral
M, Besinlerin sindirilip organik faâliyetlerde kullanılması, su, üre ve tuzlar gibi yan ürünlerin organizmadan dışarı atılması faâliyetleri, Metabolizma
M, Bir şeyi gerçekte olduğundan daha fazla, daha büyük gösterme, abartma, Mübalağa
M, Demir gibi bazı metalleri kendine çeken, orta yerinden asıldığı zaman hep kuzey-güney istikametini gösteren demir çubuk, Mıknatıs
M, Dînî nikâh esnâsında belirlenen ve erkek tarafından kadına verilmesi gereken mal yâhut para, nikâh bedeli, Mehir
M, Cinsi saf ve hâlis olmayan, ayrı türlerin birleşmesinden meydana gelen canlı, Melez
M, Sıvacıların, duvarcıların sıva veya beton düzeltmekte kullandıkları ensiz, uzun ve düz tahta, Mastar
M, Tanıtım amacıyla veya hâtıra olarak üretilen ve arkasındaki mıknatısla daha çok buzdolabı kapısı gibi metal yüzeylere iliştirilerek kullanılan nesne, Magnet
M, Hayvan otlatılan yer, otlak, Mera
M, Öğretim ve eğitim sistemi, Maarif
M, Binâ, gemi, heykel vb.nin belirli bir ölçeğe göre küçültülerek yapılmış olan taslak hâlindeki modeli, Maket
M, Bir toplantıda yapılan müzâkereleri, alınan kararları tespit için yazılan ve toplantıya katılanlar tarafından imzâlanan belge, Mazbata
M, Bir ressam veya heykeltıraşa poz veren kimse, Model
M, 42.195 metrelik en uzun yol koşusu, Maraton
M, Ateş veya kızgın bir şey tutmaya, korları karıştırmaya yarayan iki kollu metal araç, Maşa
M, Bisiklet çatısının ön ve arkasındaki çatal biçiminde, tekerleklerin takıldığı parça, Maşa
M, Şoför yardımcısı, Muavin
M, Yahudi dini ritüellerinde kullanılan ve hem eski hem de modern İsrail'de sembol olan çok kollu bir şamdan türü, Menora
M, Ritmi, yürüyen bir kimsenin veya topluluğun adımlarını hatırlatan müzik parçası, Marş
M, Askerlikte yürüyüşe geçmek için verilen komut, Marş
M, Otomobil, kamyon, tren vb. motorlu araçlarda motoru işletme düzeni, Marş
M, Politikada, amaca ulaşmak için ahlaka aykırı da olsa her türlü aracı hoş gören anlayış, Makyavelizm/Makyavelcilik
M, Uğur getirdiğine inanılan şey veya kimse, Maskot
M, Hastanelerde veya mezarlıklarda ölülerin belirli süre için saklandıkları soğuk ortam, Morg
M, Bir okulu bitirerek diploma almış kimse, Mezun
M, Bazı kesin kurallara bağlı rahip veya rahibelerin dünya ile ilgilerini keserek yaşadıkları yapı, Manastır
M, Sevinmeye yol açan, sevindirici haber, Müjde/Muştu
M, Arapçadan kelime kelime çevirmeksizin, asıl anlatılmak istenileni ifade ederek yapılan Kur’an çevirilerinin ortak adı, Meal/Me'al
M, Yazılmış veya basılı bir kâğıdın kenarında bırakılmış boşluk, Marj
M, Bir sayı dizisi küçükten büyüğe sıralandığında tam ortada yer alan değer, Medyan
M, Ökaryotik hücrelerde çekirdek bölünmesiyle başlayan ve genetik yapısı ana hücreyle aynı, kromozom sayısı değişmeyen iki yeni hücre oluşturan bölünme şekli, Mitoz/Mitoz Bölünme
M, Eşeyli üreyen canlılarda üreme ana hücrelerinden genetik çeşitliliğe sahip dört yeni haploit hücre oluşturan hücre bölünmesi, Mayoz/Mayoz Bölünme
M, İpe serilen çamaşırı tutturmak için kullanılan yaylı kıskaç, Mandal
M, Mide, bağırsak vb. içi boş organların iç yüzeylerini kaplayan, sümüksü bir sıvı ile örtülü tabaka, Mukoza
M, Üzerine iplik, tel, şerit vb. sarılan, kenarları çıkıntılı, ekseni boyunca delik silindir, Makara
M, Bir yükün yukarıya kaldırılmasını sağlayan araç, Makara
M, Abdest alırken ıslak eli başın en az dörtte birine veya mest üzerine sürme, Mesh/Mesh Etme/Mesh Etmek
M, Otomobil, gemi, lokomotif vb. taşıtlara bir yere yanaşmak, bir yerden çıkmak, hat değiştirmek vb. bir sebeple yaptırılan hareketler, Manevra
M, Yakıldığı zaman duman ve koku çıkararak baş ağrısına sebep olan yarı yanmış kömür, Marsık
M, Sınırdaki koruma görevlisi, Marsıvan
M, İnsanlığın ihtiyaçlarını karşılamak için iyi bir estetik tasarım ile temel bilimler çerçevesinde en az maliyette en yüksek verimlilik ve güvenlikte teknoloji veya sistem geliştiren kimse, Mühendis
M, İl ve ilçelerde din görevlilerinin amiri olan ve dinî konularda fetva verme yetkisi bulunan devlet memuru, Müftü
M, Kötü ve zararlı bir davranışa aynı şekilde karşılık verme, aynını yaparak karşılama, Misillleme
M, ir kişinin, başkalarının duygu, düşünce ve davranışlarını kendi çıkarları doğrultusunda, gizli, kurnazca veya sinsi taktiklerle kontrol etmesi ve yönlendirmesi, Manipülasyon
M, Kalın karton, Mukavva
M, Maddenin miktar birimi, Mol
M, En yüksek askeri rütbe, Mareşal
M, Kuvvetin, bir cismi bir nokta veya bir eksen yörüngesinde döndürme etkisini belirleyen vektör niceliği, Moment
M, Bir cismin hareket miktarı, kütlenin sürat ile çarpımı, Momentum
M, Doğru düşünmenin yöntemini, kurallarını ortaya koyan bilim, Mantık
