letter, question, answer
L, İnce, geniş makarna yapraklarının arasına beşamel sos, bolonez sos ve peynir konularak kat kat dizilmesiyle hazırlanan, fırınlanmış köklü bir İtalyan hamur işi yemeği, Lazanya
L, Nişastalı tanelerin, su ile kaynatılarak bulamaç kıvamına getirilmiş durum, Lapa
L, Hayvan ve bitki dokularının eter, benzen, kloroform vb. yağ çözücülerinde eriyen bölümü, Lipit
L, Mecazi anlamda herhangi bir düzenin iyi işlemez olması, gevşemek, bozulmak, Laçkalaşmak
L, Deri ve saç bakımında kullanılan alkollü veya alkolsüz, kokulu sıvı, Losyon
L, Gemilerin barınmalarına, yük alıp boşaltmalarına, yolcu indirip bindirmelerine yarayan doğal veya yapay sığınak, Liman
L, Nazik, hoş, ince espri, Latife
L, Bozulmuş veya bozulmaya yüz tutmuş olan dostluk ilişkisi, Limoni
L, Nitelikleri, özü, hareketleri, davranışlarıyla bir şeyi elde etmeye hak kazanmış olan, Layık
L, Belli bir iş kolunda usta, kalfa ve çırakları içine alan esnaf kuruluşu, Lonca
L, Mecaz anlamda ara vermeden söylenilen saçma sapan söz dizisi, Laklak
L, Bir sporcunun resmî yarışmalara katılabilmesi için spor federasyonunun kendisine verdiği kayıt fişi veya kimlik kartı, Lisans
L, Genellikle dört yıl süren üniversite veya yüksekokul öğrenimi, Lisans
L, Çamgillerden, 50-60 metre yüksekliğinde, düz gövdeli, kozalağı aşağıya doğru sarkık, kerestesi ve reçinesi değerli, çam türüne çok yakın bir orman ağacı, Ladin
L, Kamaralarla alt güverteleri aydınlatmak için bordalardan ve güvertelerden açılan yuvarlak pencere, Lomboz
L, Tanrı'nın merhametinden yoksun olma, Lanet
L, Belirli bir konu veya bilim dalında yayınlanmış kitap, makale, tez ve akademik çalışmaların tümünü ifade eden terim, Literatür
L, Taş bilimi, Litoloji
L, Çalgı onaran veya yapıp satan kimse, Lutiye
L, Şehzadelerin özel eğitmenleri, Lala
L, Ayakkabı boyama, Lostra
L, Eti ve karnı beyaz, sırtı koyu, hafif pullu, kemikli bir balık, Lüfer

M, Hafif makineli tüfek, Mirtalyöz
M, Dört dizeli bentlerden oluşan divan şiiri, Murabba
M, Eğlendirici, güldürücü kişi, Maskara
M, I. Dünya Savaşı’ndan sonra bazı az gelişmiş ülkelerin, bağımsızlığa hazır hâle gelene kadar Milletler Cemiyeti adına büyük devletler tarafından yönetilmesi yetkisi, Manda
M, Başkalaşma, Metamorfoz
M, Sahip olunan mal veya paralar, Maddiyat
M, Para, kazanç karşılığı olarak kötü, uygunsuz işler çeviren kimse, Mürtekip
M, Gösteri amacıyla veya bir olaya dikkati çekmek için genellikle açık yerlerde yapılan toplantı, Miting
M, Fabrika yapımı her türlü kumaş, bez vb. dokuma, Manifatura
M, Bir tarafına kauçuk veya yağlı boya sürülerek su geçirmeyecek duruma getirilen kalın bez, Muşamba
M, ağmur sularını kanalizasyon şebekesine çekmek için kullanılan üzeri parmaklıklı demirle kapatılmış delik, Mazgal
M, İçi yumuşak bir malzeme ile doldurularak dikilen, oturmaya, yaslanmaya yarar şilte, Minder
M, Hamur kıvamına getirilmiş madde, Macun
M, Nane kokusu, Mentol
M, Tekrarlama sonucu kazanılan yatkınlık, alışkanlık, Meleke
M, Büyükbaş ve küçükbaş hayvanların süt elde etmek amacıyla beslenip barındırıldığı, süt ve süt ürünlerinin üretildiği çiftlik, Mandıra
M, Açık artırma ile satış yapılan yer, Mezat
M, Dinî kurallara uygun olarak kesilmemiş olan hayvan, Murdar
M, Fransızcadan dilimize giren hiç değiştirmeden anlamında kullanılan bir zarf, Motamot
M, Yer kabuğunun bazı bölgelerinde çeşitli iç ve dış doğal etkenlerle oluşan, ekonomik yönden değer taşıyan mineral, Maden
M, Siyasi otoritenin genellikle miras yolu ile bir kişinin üzerinde toplandığı devlet düzeni, Monarşi
M, Bir şeyin bal mumu, alçı vb. bir madde ile kalıbını çıkarmak için yapılan işlemlerin bütünü, Mulaj
M, Rusya'nın başkenti, Moskova
M, Bakırdan yapılmış, iki buçuk para değerinde sikke, Mangır
M, Alevilikte özel bir dinî tören ile atanan ve kişinin hem dünyada hem de ahirette kardeşi ve yoldaşı kabul edilen kimse, Musahip
M, Bağnaz, Mutaassıp
M, Ele geçirilmiş, zapt edilmiş, Mazbut
M, Savaşçıların veya itfaiyecilerin başlarına giydikleri demir başlık, Miğfer
M, Gözle görülüp elle tutulamayan, madde ve cisimle ilgisi bulunmayan anlamında bir sıfat, Manevi
M, Eski Yunan felsefesinde bölünmez birlik, Monat
M, Bir kişi, grup, siyasi parti veya sanat akımının inançlarını, niyetlerini ve amaçlarını kamuoyuna açıkça ilan eden yazılı bildiri veya beyanname, Manifesto
M, Bir mücadelede üstünlük elde etmiş, utkulu, Muzaffer
M, Dikkat çekmek, toplumda odak noktası hâline gelmek için yalana başvuran, bir noktadan sonra kontrolü kaybederek söylediği yalana kendisi de inanmaya başlayan kimse, Mitomani
M, Kısa ökçeli, bağsız ayakkabı, Makosen
M, Atların eğitildiği, binicilik derslerinin yapıldığı ve antrenmanların gerçekleştirildiği, özel bir zeminle kaplı açık veya kapalı eğitim alanı, Manej
M, Yapılan bir iyiliğe karşı kendini borçlu sayma, gönül borcu, Minnet
M, Hücrede enerji üretiminden sorumlu olan ve oksijenli solunumun gerçekleştiği organel, Mitokondri

N, Inception, The Prestige ve Oppenheimer gibi dünyaca ünlü filmlerin yönetmeni, Christopher ..., Nolan
N, Gerçekten, hakikaten anlamına gelen bir zarf, Nitekim
N, Akraba ve yakın arkadaşları kayırma, Nepotizm
N, Birini üzmek için veya inat olsun diye yapılan iş, Nispet
N, Yargılama ve değerlendirmenin kendisine göre yapıldığı ölçüt, uyulması gereken kural, Norm
N, Hayvanın yürüyüşünü hızlandırmak için üvendirenin veya kısa bir sopanın ucuna çakılmış sivri demir çivi, Nodul
N, Tarlayı sürüp herhangi bir şey ekmeden dinlenmeye bırakma, Nadas
N, İstenilen düzene, kurallara uygun olan, Nizami
N, Bir toplum içinde ahlak kurallarına ve toplumsal değerlere bağlılık, Namus
N, İlahi bir güç tarafından gönderildiğine inanılan parlaklık, Nur
N, Gelinin düğün sırasında ihtiyaçlarını karşılamak üzere yanında bulunan yakın kız veya kadın arkadaşı, Nedime
N, Duvar içinde bırakılan oyuk, Niş
N, Sarhoş veya külhanbeyi bağırması, Nara
N, Hatay ili ve çevresinde yaşayan bir topluluk, Nusayri
N, Tenis, masa tenisi gibi oyunlarda servis atışlarında topun karşı sahaya geçerken fileye değdiğini belirten söz, Net
N, II. Dünya Savaşı'nda Müttefik Devletlerin Nazi işgali altındaki Fransa'ya başlattığı deniz operasyonu, ... Çıkarması, Normandiya
N, Birinin geçindirmekle yükümlü bulunduğu kimselere, mahkeme kararıyla bağlanan aylık, Nafaka
N, Huzursuzluk, ara bozma sebebi olacak şeyleri yapmak anlamında eklemek, ... ... ekmek, Nifak Tohumu
N, Belli kimselerde bulunduğuna inanılan, kıskançlık veya hayranlıkla bakıldığında insanlara, eve, mala mülke hatta cansız nesnelere kötülük verdiğine inanılan uğursuzluk, Nazar
N, Çivi, kilit, menteşe gibi yapı işlerinde kullanılan şeyleri satan kimse, Nalbur
N, Hayvanların ayağına nal çakan kimse, Nalbant
N, Belli sayıda noktanın konumunu kesin olarak tespit edebilmek için, bu noktaları tepe olarak kabul ederek bir alanı üçgenlere bölme işi, Nirengi
N, Vücudun herhangi bir bölgesinde veya dokusunda ortaya çıkan anormal doku büyümeleri, Nodül
N, Çağırma, bağırma, seslenme, Nida

O, Şeffaf zıttı, mat yüzey, Opak
O, İzcilikte küçük birliklerin başı, Oymakbaşı
O, Eski Yunan tiyatrolarında, sahne ve seyirciler arasındaki çember biçiminde olan koro yeri, Orkestra
O, Yaptırma, yasak etme, emretme, itaat ettirme hakkı veya gücü, Otorite
O, Güvenlik güçlerince suçluların yakalanması için düzenlenen eylemler bütünü, Operasyon
O, Eskiden beri mevcut olan özelliklerini taşıyan, Otantik
O, Serbest meslek adamlarını içinde toplayan resmî birlik, Oda
O, Hem et hem ot ile beslenen canlı, Omnivor
O, Bir işi doğru ve uygun bulmak, tasvip etmek, Onamak
O, Hücre içerisinde bulunan kendi içinde özelleşmiş yapı, Organel
O, Yüzeyi ışığa karşı duyarlı bir madde ile kaplı kâğıt üzerine, kalıptan çekilmiş resim kopyası, Ozalit
O, Eski Yunanistan'da Zeus onuruna yapılan yarışmalar, Olimpiyat
O, Hamur açmakta kullanılan, silindir biçimindeki uzun, ince değnek, Oklava
O, Varlığı deneyle kanıtlanmış şey, Olgu
O, Elle yapılan kalın, seyrek dikiş, Oyulga
O, Gemi kaburgasının baş bodoslamadan kıç bodoslamaya kadar alttan devam eden ağaç veya sacdan yapı ögesi, Omurga
O, İyi huylu kimse, Oğuz
O, Saç diplerinin koyu bırakılıp uçlara doğru rengin kademeli olarak açıldığı popüler bir saç boyama tekniği, Ombre

P, Hamamda örtünmek için kullanılan ince dokuma, Peştamal
P, Sansargillerden, su kıyılarında kazdıkları deliklerde yaşayan, ot ve etle beslenen, memeli bir hayvan, Porsuk
P, Kumaş, kâğıt vb. maddelerde bir bölümün öbürünün üzerine getirilmesiyle oluşturulan kıvrım, Pile
P, II. Dünya Savaşı’nda Alman ordusunun kullandığı, günümüzde polis tarafından da kullanılan zırhlı, hafif silahlı araç, Panzer
P, pembeye çalan beyaz tüylü, kanatları gri renkli, alt gagasında deriden bir kesesi olan iri kuş; kaşıkçı kuşu, Pelikan
P, Hristiyanların ve Yahudilerin belli günlerde et, yağ vb. yiyecekleri yemeden tuttukları oruç, Perhiz
P, İçinde dükkânlar bulunan, üzeri kapalı veya açık çarşı, Pasaj
P, Ucundaki lüle içine tütün konulan ve yakılarak dumanı çekilen kısa, çubuk biçimindeki tütün içme aracı, Pipo
P, Görüş uzaklığını çok azaltmayan bir tür hafif sis, Pus
P, Kamyon, otomobil vb. kara taşıtlarına takılan numara levhası, Plaka
P, Belirli bir sürenin sonunda belirli bir parayı kendi adına veya bir başkasının emrine ödemesi için alacaklının borçluya yazdığı bildiri, Poliçe
P, Kılığının veya eşyasının düzgün ve temiz olmasına özenmeyip düzensizlik içinde yaşayan kimse, Pasaklı
P, Matematikte teoremler veya kurallar yardımıyla çözülmesi istenen soru, Problem
P, Başkasının malını birine armağan etmek, ... çekmek, Peşkeş
P, Kaz, ördek, güvercin vb. bazı kuş yavrularının civcivlikten sonraki durumu, Palaz
P, Antlaşma, Pakt
P, Bir alışveriş veya hizmet için önceden verilen para, Peşinat
P, Kavisli, kısa, uç bölümü geniş, kabzasına doğru daralan bir tür kılıç, Pala
P, Hammaddesi petrol olan, ısıya karşı dayanıklı, hafif, kabarık hacimli ve yumuşak bir tür kumaş, Polar
P, Bazı araçlarda, motorlarda bir silindir içinde düzenli hareket eden daha küçük çaplı silindir, Piston
P, Gösteri yapmak, dans etmek vb. için düzenlenmiş, genellikle yuvarlak yer, Pist
P, Futbolda oyunculardan birinin topu takım arkadaşına atması, Pas
P, Bir hava taşıtını yönetme, Pilotaj
P, Sebzeyi, eti ezerek veya süzgeçten geçirerek elde edilen ezme, Püre
P, Sunulabilir durumda olan, derli toplu, düzenli, Prezantabl
P, Otomobil yarışlarında aracı kullanan kimse, Pilot
P, Mikrobiyolojinin kurucusu kabul edilen Fransız kimyager ve mikrobiyolog, Louis ..., Pastör
P, Noktalı, benekli kumaş, Puantiye
P, Mayalı hamurdan yapılan, yağda kızartılarak pişirilen bir yiyecek, Pişi
P, Mecaz anlamda bir yerde hiçbir iş yapmadan oturmak, Pineklemek
P, Herhangi bir konuda gerçeğe aykırı, uydurma söz veya haber, Palavra
P, Pudra sürmek için kullanılan yumuşak tüylü tuvalet gereci, Ponpon
P, Operada başrol oynayan kadın oyuncu, Primadonna
P, Kaz, ördek, martı gibi hayvanların parmaklarını birbirine bitiştiren zar, Perde
P, Üzerine bir cismin görüntüsü yansıtılan saydam olmayan yüzey, Perde

R, Zarara uğrama tehlikesi, Risk
R, 1950'lerde ABD'de doğan, elektro gitar, bas gitar ve davul merkezli, güçlü ritimlere sahip popüler bir müzik türü, Rock
R, Bir mağazanın yalnız bir tür eşya satılan bölümü, Reyon
R, Bir devletin yönetim biçimi, Rejim
R, İkiyüzlülük, Riya
R, Gözlemevi, Rasathane
R, Et suyu, buğday eriştesi, soya sosu veya miso gibi çeşniler ve yumurta, nori gibi çeşitli malzemelerle hazırlanan Japon erişte çorbası, Ramen
R, Kendisine kitap indirilmiş peygamber, Resul
R, Bir bilyenin, dönmekte bulunan derin tepside yazılı numaralarından ve siyah ile kırmızı renklerden birinin üzerinde durmasıyla kazananı belirten bir kumar oyunu, Rulet
R, Bir dairede yarıçap uzunluğundaki yay parçasını gören merkez açıya eşit açı ölçme birimi, Radyan
R, Hava, su veya buharı ısıtmak veya soğutmak suretiyle meydana gelen sıcaklığı veya soğukluğu yayan, ısıtma ve soğutmada kullanılan cihaz, Radyatör
R, Koyun sütünden yapılan, mahzenlerde olgunlaştırılan, içi özel küflü peynir, Rokfor
R, Geçerli ve değerli olma, herkesçe istenme, Revaç
R, Verim, Randıman
R, Karşı çıkış, Rest
R, Kişinin olumsuz duygu, düşünce veya yaşanmış travmatik olayları çözüm üretmeksizin zihninde sürekli tekrar etmesi, aşırı düşünme döngüsüne girmesi, Ruminasyon
R, Uygun bulan, benimseyen, isteyen, kabul eden, Razı
R, Dönen bıçakları sayesinde içine konulan gıdaları kıyma, parçalama, doğrama işine yarayan mutfak aleti, Rondo
R, Bir işte bir kimse veya şeyin üstüne düşen görev, Rol
R, Arapça'da ortaokul derecesinde olan eğitim kurumu, Rüştiye
R, Yarışmacıların otomobille belli yolları izleyerek ve özel kurallara uyarak belirli bir yere ulaşmalarına dayanan otomobil yarışı, Ralli
R, Et, tavuk veya sebze suyunda pişirilerek krema kıvamına getirilmiş bir tür İtalyan usulü pirinç pilavı, Risotto

S, Gelip geçici, çabuk sona eren anlamına gelen bir söz, ... alevi, Saman
S, Sebze ve meyvelerin yetiştirildiği ve hava şartlarına karşı korunduğu cam ve naylonla kaplı yer, Sera
S, Gaz veya sıvıların tek yönlü geçişini sağlayan, akışı açıp kapatarak düzenleyen mekanik kapakçık sistemi, Sibop
S, Bir cisim, katı durumdan sıvı durumuna geçmeden doğrudan doğruya gaz durumuna dönüşme, Süblimleşme
S, Suya karbondioksit ve bikarbonat eklenerek elde edilen, sindirimi kolaylaştırmak için tüketilen içecek, Soda
S, Duyu ve hareket uyarılarını beyinden organlara, organlardan beyne ileten beyazımsı teller ve bu tellerin oluşturduğu demet, Sinir
S, Belirli bir süre içinde arka arkaya giden şeyler, dizi, Sekans
S, Ağaçlarda yaşayan, genellikle meyveyle beslenen, çok tüylü, uzun kuyruklu, ince gövdeli bir hayvan, Sincap
S, Ceza olarak belli bir yerin dışında veya belli bir yerde oturtulan kimse, menfa, Sürgün
S, İçine bir şey katılmamış olan, Sade
S, Dik, çıkması ve geçilmesi güç yer, Sarp
S, Ağızdan sızan tükürük, Salya
S, Anlam bilimi, Semantik
S, Zambakgillerden, yumrusu ve yeşil yaprakları salata ve yemeklere tat vermek için kullanılan, acımsı, keskin kokulu bir bitki , Soğan
S, At takımları, araba koşumları, deriden ve meşinden eşya yapılan ve satılan yer, Saraçhane
S, Atletizmde, atlama dalında, bir sporcunun belli yükseklikteki çıtayı aşmak için destek aldığı uzun ve esnek sopa, Sırık
S, Kapı, pencere vb.ndeki aralıkları örterek hava ve su geçmesini önlemek amacıyla kullanılan şeffaf ve yapışkan bir madde, Silikon
S, İşçilerin veya işverenlerin iş, kazanç, toplumsal ve kültürel konular bakımından çıkarlarını korumak ve daha da geliştirmek için aralarında kurdukları birlik, Sendika
S, Korunulacak, arkasına, altına veya içine girerek saklanılacak yer, Siper
S, Bir müzik parçasının bir kişi tarafından söylenmesi veya çalınması, Solo
S, Cıvatanın ucuna geçirilen, içi yivli demir başlık, Somun
S, İpin yanı sıra altın ve gümüş tellerle dokunan, kaftan ve giysi dikiminde kullanılan bir tür ipekli kumaş, Sündüs
S, Çiçeksiz bitkilerde üreme organı, Spor
S, Ticaret gemilerinde kaptanlık yapan kimse, Süvari
S, Çin dili, medeniyeti, tarihi vb. konuları inceleyen bilim dalı, Sinoloji
S, Tapınaklarda dinî tören eşliğinde üzerinde kurban kesilen, günlük yakılan taş masa, Sunak
S, Mızmız, sevimsiz, başkalarıyla ilişki kurmayan kimse, Sinameki
S, Besinlerin çeşitli enzimlerle eritilerek, parçalanarak ince bağırsakta emilebilir, kana karışabilir duruma gelmesi için uğradıkları fiziksel ve kimyasal değişikliklerin bütünü, Sindirim
S, Öğrencilerin veya bir işe girmek isteyenlerin bilgi derecesini anlamak için yapılan yoklama, Sınav
S, Ağaç, kumaş vb. yapılmış bir kanal içinde hareket ederek açılıp kapanan perde, Stor
S, Özel veya kamu kuruluşlarında belli bir makama, kişiye yardımcı olmak amacıyla haberleşmeyi sağlayan, yazışma yapabilen görevli, Sekreter
S, Vücudun içinde birikip dışarı atılamayan sıvıyı çekmek veya vücuda sıvı vermek için kullanılan araç, Sonda
S, Çoğunlukla askerî birliklere verilen yazı işlemeli, kenarları saçaklı ve gönderli bayrak, Sancak
S, Tarihi, kültürel veya arkeolojik güzellikleri nedeniyle devlet tarafından koruma altına alınan, yapılaşma ve değişiklik yapılması kısıtlanan veya yasaklanan alanlara verilen ad, ... Alanı, Sit
S, Bir şeyi çekerek, esneterek uzatmak, Sündürmek
S, Halk şiirinde sevgi, doğa, güzellik konularını işleyen, genellikle koşma gibi kafiyelenen, sekizer hece ölçüsüyle yazılmış şiir, Semai

T, Batı Afrika kıyılarında esen güçlü hava akımı, Tornado
T, İlerleme, yükselme anlamlarında kullanılan Arapça kökenli bir sözcük, Terakki
T, Güzel sanatlarda kendine özgü teknik, renk ve biçimlendirme biçimi; üslup, stil, konsept, Tarz
T, Kanın pıhtılaşmasına yardımcı olan renksiz kan hücreleri, Trombosit
T, At, eşek vb. tek tırnaklı hayvanların tırnağı, Toynak
T, Üzerine resim yapılan, gerdirilmiş keten, kenevir veya pamuklu kaba kumaş, Tuval
T, Vücuttaki iş yapabilme, başarabilme gücü; derman, mecal, Takat
T, internet ortamında insanların keyfini kaçırmak, tartışma çıkarmak veya provokasyon yapmak amacıyla ironik, hakaret içerikli ya da kışkırtıcı mesajlar paylaşan kişi, Trol
T, Metal paranın resimli yüzü, Tura
T, Mavi, yeşil ve beyazın karışımından ortaya çıkan renk, Turkuaz
T, Yer yüzeyinin özelliklerini kâğıt üzerinde çizerek gösterme işi, Topoğrafya
T, Fiyat gösteren çizelge, Tarife
T, Bir tiyatro oyununda oyuncuların bir defada söylediği parça, Tirat
T, Konusunu efsanelerden veya tarihsel olaylardan alan, acıklı sonuçlarla bağlanan bir tür tiyatro eseri, Trajedi
T, Kokusuz, suda eriyen, yiyecekleri korumada ve tatlandırmada kullanılan billursu madde, Tuz
T, Kutuplara yakın bölgelerin bitki örtüsü, Tundra
T, Kimyada durgun hâldeyken kütleli olan, çok küçük boyutlu madde, Tanecik
T, Özbekistan'ın başkenti, Taşkent
T, Ağacın kesilerek silindir biçimine getirilmiş gövdesi, Tomruk
T, İnce keskin ses, pes karşıtı, Tiz
T, Mecaz anlamda güçsüzleşmek, bitkinleşmek, Tükenmek
T, Bilgisayar yazıcısı veya fotokopi makinesinde kullanılan toz durumundaki mürekkep, Toner
T, Merdiven korkuluğu, Tırabzan
T, Fincanın dibine çöken kahve tortusu, Telve
T, Otomobillerde, içinde sürücü için gerekli şeylerin bulunduğu kapaklı küçük bölme, Torpido
T, Dürülerek boru biçimi verilmiş deriler veya kâğıtlar, Tomar
T, Başsağlığı, Taziye
T, Genellikle pamuk ve kıldan dokunmuş, türlü boy ve biçimde, ağzı büzülüp bağlanabilen araç, Torba
T, Bitkilerde döllenme sonunda yumurtacıktan oluşan ve yeni bir bitki oluşmasını sağlayan tane, Tohum
T, Eski Yunan'da siyasal gücü zorla ele geçiren, onu kötüye kullanan kimse, Tiran
T, Genellikle ünlü bir kimse için yaptırılan ve içinde o kimsenin mezarı bulunan yapı, Türbe
T, Tıpta yüksek dozda verilen herhangi bir ilaca karşı vücudun gösterdiği dayanma gücü, Tolerans

U, Afrika kıtasının doğu kesiminde yer alan ve denize kıyısı olmayan bir kara ülkesi, Uganda
U, Düz arazide veya açık denizde gökle yerin birleşir gibi göründüğü yer, Ufuk
U, Radyoaktif bir kimyasal element, Uranyum
U, Bir nesnenin uzayda kapladığı yer, Uzam
U, En uç kısımda serviks adı verilen rahim ağzı ve her iki yanda yumurtalıklara uzanan fallop tüpleri bulunan kadın üreme organı, dölyatağı, Uterus
U, Fikir, sanat ve endüstri alanlarında çok büyük bir gelişme göstermiş olan, medeni, Uygar
U, Ele avuca sığmaz, çok haşarı kimse, Uçarı
U, Güneş'e uzaklık sırasında yedinci olan ve Güneş çevresindeki dolanımını seksen dört yılda tamamlayan gezegen, Uranüs
U, Gökyüzünde görülen ancak gözlemci tarafından hemen tanımlanamayan, kökeni bilinmeyen her türlü hava aracı, atmosferik olay veya nesne, Ufo
U, Tıraş için kullanılan, açılır kapanır, çok keskin bıçak, Ustura
U, Türlü amaçlarla yerden fırlatılan ve genellikle kapalı bir yörünge çizerek yer çevresinde dolanan araç, Uydu
U, Karadeniz ağzında erkek çocuk, Uşak
U, Haberci, Ulak
U, Televizyon, müzik seti vb. aletleri, otomobil, oyuncak otomobil vb. araçları belli bir uzaklıktan çalıştırmaya yarayan kablosuz alet, Uzaktan Kumanda
U, Zanaat öğreticisi, Usta
U, Bir şeyin olmasını istemek, ümitle beklemek, Ummak

V, Bir görevde asıl görevlinin yerine bakan kimse, Vekil
V, ahıl tanelerinin damıtılmasıyla elde edilen alkollü içecek, Votka
V, Öğüt niteliği taşıyan dini konuşma, Vaaz
V, Bir kimsenin iyiliğini gördüğü, birçok şeyini ona borçlu olduğu kimse, Velinimet
V, Polisi ilgilendiren olay, Vukuat
V, Bir iş yerinde çalışanların belirli zaman dilimlerinde nöbetleşe, sıralı veya dönüşümlü olarak görev yaptığı çalışma sistemi, Vardiya
V, Osmanlı Devleti'nde zamanın olaylarını tespit etmek ve yazmakla görevli devlet tarihçisi, Vakanüvis
V, Sevgiliyle kavuşma, Vuslat
V, İnsan veya hayvanda beden, baş, kol ve bacakların oluşturduğu bütün, Vücut
V, Eski kültür ve sanat anıtlarını yakıp yıkan, bunların değerini bilmeyen kimse veya topluluk, Vandal
V, Aralıksız anlamında kullanılan bir zarf, Vira
V, Bir işin yapılması veya bir borcun ödenmesi için tanınan süre, mühlet, Vade
V, Polonya'nın başkenti, Varşova
V, Kişiyi kendi davranışları hakkında bir yargıda bulunmaya iten, kişinin kendi ahlak değerleri üzerine dolaysız ve kendiliğinden yargılama yapmasını sağlayan duygu, Vicdan
V, Bir yetimin veya akılca zayıf, hasta birinin malını yöneten kimse, Vasi
V, Otel, restoran, alışveriş merkezi, düğün salonu vb. yerlerde gelen müşteri ve misafirlerin araçlarını otoparka park etmekle görevli kimse, Vale
V, Baş dönmesi, Vertigo

Y, Japonya kökenli uluslararası organize suç gruplarının üyelerine verilen isim, Yakuza
Y, Gündelik, Yevmiye
Y, 1 birimi yaklaşık olarak 0,91 metreye eşit olan bir uzunluk birimi, Yard
Y, Allah tarafından insanın başına gelmesi ezelde kararlaştırılmış olan şeyler, mukadderat, Yazgı
Y, (Star Wars) evreninde yer alan, en yaşlı ve en bilge Jedi Ustası olan kurgusal bir karakter, Yoda
Y, Kişi, toplum vb. özündeki iyi niteliklerini, değer yargılarını, birtakım dış etkenlerle yitirerek bozulmak, kötüye gitmek; dejenereleşmek, Yozlaşmak
Y, Parmakların kapanmasıyla elin aldığı biçim, Yumruk
Y, Bir şeye istenilen biçimi vermek için dış bölümünü keskin bir araçla biçme, Yontma
Y, Top veya küre biçiminde olan, Yuvarlak
Y, Tabiatta gruplar hâlinde serbest dolaşan yabani at sürüsü, Yılkı
Y, Birdenbire oluşan aşk, ... aşkı, Yıldırım
Y, Hoşa gitmeyen, tatsız olan, Yavan
Y, Kahvelerde oynanan oyunları seyreden ve bedavadan yiyip içen kimse, Yancı
Y, Bitki, tüy vb. çekerek yerinden çıkarmak, çekip koparmak, Yolmak
Y, Doğuştan beri geçen ve yıl birimi ile ölçülen zaman, Yaş
Y, Herhangi bir şeyden çekinmeme, korkmama, yüreklilik, korkusuzluk durumu, Yürek
Y, Delik ve yırtığı uygun bir parça ile onarma, kapatma, Yama
Y, Kötü işlerde birine yardım eden kimse, Yardakçı
Y, Bakıma ve barınmaya muhtaç bir grup insanın oturduğu, yetiştirildiği veya bakıldığı kurum, Yurt
Y, Mecaz anlamda övünç kaynağı, Yüz Akı
Y, Bir kimsenin kardeşinin, dayısının veya amcasının karısı, Yenge
Y, Doğada olduğu gibi kalarak işlenmemiş olan, Yoz
Y, Bir cismin birim hacminin kütlesi, Yoğunluk
Y, Dağın veya tepenin herhangi bir yanı, Yamaç
Y, Sesin yansıtıcı bir yüzeye çarpıp geri dönmesiyle duyulan ikinci ses, Yankı
Y, Kuşların ve başka hayvanların barınmak, yumurtlamak, kuluçkaya yatmak, yavrularını büyütmek veya yavrulamak için türlü şeylerden yaptıkları ve türlü biçimlerde hazırladıkları barınak, Yuva
Y, İki buçukla dört yaş arası çocukların bakıldığı, okul öncesi eğitim kurumu, Yuva

Z, Ay takviminin on ikinci ayı, kurban ayı, Zilhicce
Z, Gücüne güvenerek hükmü altında bulunanlara söz hakkı ve davranış özgürlüğü tanımayan kimse, Zorba
Z, Sülfürik asidin halk dilinde bilinen adı, Zaç Yağı
Z, Argoda çok zayıf, ince ve uzun boylu kişileri tanımlamak için kullanılan mecazi bir ifade, aynı zamanda bir balık türü, Zargana
Z, Zencefilgillerden, kök saplarından safranı andıran boyalı bir madde çıkarılan, yaprakları sivri uçlu, çiçekleri sarı renkte, çok yıllık bir bitki; Hint safranı, Zerdeçal
Z, Tavla gibi oyunlarda kullanılan kemik, fil dişi  vb. maddelerden küp olarak yapılan ve altı yüzünde, birden altıya kadar benekler bulunan oyun aracı, Zar
Z, Kilisenin işlerini yapmak ve çan çalmakla görevli kişi, Zangoç
Z, Bir işte ulaşılan en üst aşama, Zirve
