letter, question, answer
R, Hindistan, Pakistan, Nepal, Endonezya ve Sri Lanka gibi bazı Asya ülkelerinde kullanılan resmi para birimi, Rupi
R, Çeşitli uyarıları alabilen ve duyu organlarının yapısında bulunan özelleşmiş hücre, hücre grupları veya sinir uçları, Reseptör
R, Şiirde uyaktan sonra tekrarlanan, aynı harflerden oluşan kelime veya ek, Redif
R, Bir dizede, bir notada vurgu, uzunluk veya ses özelliklerinin, durakların düzenli bir biçimde tekrarlanmasından doğan ses uygunluğu, Ritim
R, Kirpikleri kıvırmak ve daha uzun göstermek için fırça ile sürülen yağlı sürme, Rimel
R, Devlet tahvili veya hazine bonosu gibi sabit getirili bir menkul kıymetin, belirli bir vade sonunda başlangıç satıcısı tarafından geri alınma taahhüdüyle satılması işlemi, Repo
R, Düz, geniş başlı, kısa bir çivi görünüşünde, kâğıt veya karton vb. şeyleri bir yere tutturmak için kullanılan araç, Raptiye
R, Tanrı'nın bütün yarattıklarına verdiği nimet, Rızık
R, Kaynar suda kabuğu ile az pişirilmiş yumurta, Rafadan
R, Nem, Rutubet
R, Belli bir saatte veya yerde iki veya daha fazla kişinin bir araya gelmek üzere önceden sözleşmesi, Randevu
R, Vuruş yapan bacağın, sabit duran bacağın arkasından geçirilerek topa vurulması tekniği, Rabona
R, Bireysel ve toplumsal bir konu veya sorun etrafında, ilgili bir kişiye soru cevap şeklinde oluşturulan ve genellikle gazete veya dergide yayınlanan öğretici metin, Röportaj
R, Aslını bozmadan onarma, Restorasyon
R, Gözün arka duvarını kaplayan, ışığa duyarlı hücrelerden oluşan ince bir sinir dokusu, ağ tabaka, Retina
R, Üzerinde küçük delik ve kesici çıkıntıları bulunan, peynir, soğan, havuç vb. ufak parçalara ayırmak için kullanılan mutfak aleti, Rende
R, Bir malın, toprağın veya paranın, sahiplerine emek harcamadan, zaman içinde sağladığı getiri veya kira geliri, Rant
R, Motorlu taşıtlarda motorun en az yakıtla çalışma ayarı, Rölanti
R, Yazılmış bir metin üzerinde gereken düzeltmeleri yaparak yazıyı yayıma hazır duruma getiren kimse, Redaktör
R, Bir şeyin gerçekleşmesine çok az kalma durumu, Ramak
R, Doktor, diş hekimi veya veteriner tarafından tedavi amaçlı yazılan ve üzerinde hastaya tavsiye edilen ya da uygun görülen ilaç isimlerinin yazılı olduğu belge, Reçete
R, Sıradanlık, çeşitlilik göstermeyen, alışılagelmiş düzen içinde yapılan, Rutin
R, Dıştan gelen bir uyarım sonucu doğan hareket, salgı gibi iç tepkilere yol açan irade dışı sinir etkinliği, Refleks
R, Bir spor dalında erişilmiş derecelerin en üstünü, Rekor
R, Futbolda yüksekten gelen topa gövdeyi sırtüstü devirip makas yaparak vurma, Röveşata
R, Gecikme, Rötar
R, Üzerinde kitap okunan, yazı yazılan, bazıları açılıp kapanabilen alçak, küçük masa, Rahle
R, Osmanlı geleneğinde genellikle tek bir konu, düşünce veya mesele üzerine yazılmış küçük hacimli, kitapçık tarzındaki bilimsel, edebî veya siyasî eser, Risale
R, Sayıları göstermek için kullanılan işaretlerden her biri, Rakam
R, Bir sanatçının kariyeri boyunca yaratmış olduğu eserlerden derlenmiş sergi, Retrospektif
R, İnsanın maddi olmayan, ölümsüz, bilinç ve hayatın kaynağı olan özü veya cevheri, Ruh
R, Otellerde misafirleri karşılayan, giriş-çıkış işlemlerini yöneten bölüm, Resepsiyon
R, Bir ürün, hizmet, marka veya fikrin geniş kitlelere tanıtılması, ilgi çekilmesi ve satışların artırılması amacıyla çeşitli medya araçları kullanılarak yapılan ücretli, ikna edici ve kitle iletişimine dayalı planlı tanıtım faaliyetleri, Reklam
R, Genellikle sabahları yataktan kalkıldığında pijamanın üzerine giyilen, kuşaklı erkek sabahlık türü, Ropdöşambır
R, Motorlu araçla çekilen insan veya yük taşımak için imal edilmiş motorsuz taşıt, Römork
R, Aynı işi yapan, aynı amacı güden kimseler arasındaki çekişme, Rekabet
R, Bir üniversiteyi temsil eden, eğitimin yürütülmesinden sorumlu olan, yönetimin başı durumundaki kimse, Rektör
R, Radyo dalgaları gönderip yansıyanlarını alarak cisimlerin yerlerini, hızlarını, büyüklüklerini ve hareket istikāmetlerini belirlemeye yarayan, hava alanlarında, liman, gemi ve uçaklarda seyir güvenliğini sağlamak için kullanılan cihaz, Radar
R, Bir şeye sâhip ve mâlik olma hakkı, Rakabe
R, Bir yüksekliği belirlemek için başlangıç kabul edilen noktaya konan işaret, Röper
R, UEFA Şampiyonlar Ligi'ni en çok kazanma unvanına sahip İspanyol futbol kulübü, Real Madrid/Real Madrid CF
R, Yakaya takılmak için çeşitli biçimlerde yapılan, bir kuruluşun sembolü sayılacak genellikle küçük metal nesne, Rozet
R, Vücutta görülen gevşeklik, ağırlık, tembellik, Rehavet
R, Kristalleştirme, damıtma gibi ayırma yöntemleriyle istenmeyen maddelerden arındırılmış yağ, petrol vb., Rafine
R, Kurulu düzenin temellerine yönelik toplumsal ve ekonomik değiştirmelerden yana olan tutum veya öğreti, köktencilik, Radikalizm
R, Petrolün damıtılarak benzin, motorin vb. maddelere ayrıldığı, şeker, zeytin yağı gibi maddelerin saf ve katışıksız duruma getirildiği tesis, Rafineri
R, Hazırlanmış bir şeyin daha iyi olması için düzelmesi gereken yerleri üzerinde yapılan değiştirme, Rötuş
R, Koşarken bir yandaki iki bacağını aynı anda atan binek hayvanlarının biniciyi sarsmayan en yavaş koşma biçimi, Rahvan
R, Bir din veya inanç sistemine âit ibâdet, âyin, merâsimler ve bu esnâda uyulması gereken usûl ve kural, Ritüel
R, Mekanik ve elektrikli sistemlerde kayma sürtünmesi yerine bir yuvarlanma sürtünmesi sağlayarak enerji kayıplarını azaltmak için yataklar ile muylular arasına yerleştirilen parça, Rulman
R, Tüm prokaryot ve ökaryot hücrelerde bulunan, protein sentezinden sorumlu olan zarsız organel, Ribozom
R, Hastalık geçirenleri ve sakatları işe alıştırmak, iş yapabilmelerini sağlamak amacıyle uygulanan tedavi, Rehabilitasyon
R, DNA'nın kendini eşlemesi, Replikasyon
R, XV. yüzyıldan başlayarak İtalya’da ve daha sonra diğer Avrupa ülkelerinde hümanizmin etkisiyle ortaya çıkan, klasik İlk Çağ kültür ve sanatına dayanarak gelişen bilim ve sanat akımı, Rönesans
R, Bir yerin deniz seviyesinden yüksekliği, Rakım
R, Tenis, pingpong gibi oyunlarda topa vurmak için kullanılan, üzerine teller gerilmiş veya lastikle kaplanmış oval biçimde saplı alet, Raket
R, Arkadaşlık etme, birlikte bulunma, Refakat
R, Hastanelerde hastanın yanında kalan, hastaya yardımcı olan kimse, Refakatçi
R, Yer ayırtma, Rezervasyon
R, Yatağında veya havzasında bulunduğu hesaplanan, henüz işletilmemiş kömür, demir, petrol vb., Rezerv
R, Yatılı okul, kışla, gemi, tren gibi yerlerde birbiri üstüne yapılan yatma yerleri, Ranza
R, Tek bir sanatçının tek bir çalgı ile verdiği konser, Resital
R, Spor müsabakasında oyuncunun tek başına gösterdiği başarılı etkinlik, Resital
R, Letonya'nın başkenti, Riga
R, Kunduracılıkta köselenin yüzünü sıyırmaya ve perdahlamaya yarayan alet, Raspa
R, Güzel, etkili söz söyleme, Retorik
R, Yelkenlere açılan deliklere ve halat ilmiklerine geçirilen metal halka, Radansa
R, Karşılaştırma için başlangıç kabul edilen nokta veya yer, Referans
R, Bir işe izin verildiğini bildiren belge, Ruhsat/Ruhsatname
R, Küçük tekne kaptanı, Reis
R, Kumda birtakım çizgiler çizerek fala bakma, Remil

S, Gelip geçici, çabuk sona eren anlamına gelen bir söz, Saman Alevi
S, Sebze ve meyvelerin yetiştirildiği ve hava şartlarına karşı korunduğu cam ve naylonla kaplı yer, Sera
S, Gaz veya sıvıların tek yönlü geçişini sağlayan, akışı açıp kapatarak düzenleyen mekanik kapakçık sistemi, Sibop
S, Bir cisim, katı durumdan sıvı durumuna geçmeden doğrudan doğruya gaz durumuna dönüşme, Süblimleşme/Süblimleşmek
S, Suya karbondioksit ve bikarbonat eklenerek elde edilen, sindirimi kolaylaştırmak için tüketilen içecek, Soda
S, Duyu ve hareket uyarılarını beyinden organlara, organlardan beyne ileten beyazımsı teller ve bu tellerin oluşturduğu demet, Sinir
S, Belirli bir süre içinde arka arkaya giden şeyler, dizi, Sekans
S, Ağaçlarda yaşayan, genellikle meyveyle beslenen, çok tüylü, uzun kuyruklu, ince gövdeli bir hayvan, Sincap
S, Ceza olarak belli bir yerin dışında veya belli bir yerde oturtulan kimse, menfa, Sürgün
S, İçine bir şey katılmamış olan, Sade
S, Bir evrakın işleme konulmasını engellemek, Sümen Altı/Sümen Altı Etmek
S, Dik, çıkması ve geçilmesi güç yer, Sarp
S, Ağızdan sızan tükürük, Salya
S, Anlam bilimi, Semantik
S, Zambakgillerden, yumrusu ve yeşil yaprakları salata ve yemeklere tat vermek için kullanılan, acımsı, keskin kokulu bir bitki , Soğan
S, At takımları, araba koşumları, deriden ve meşinden eşya yapılan ve satılan yer, Saraçhane
S, Atletizmde, atlama dalında, bir sporcunun belli yükseklikteki çıtayı aşmak için destek aldığı uzun ve esnek sopa, Sırık
S, Kapı, pencere vb.ndeki aralıkları örterek hava ve su geçmesini önlemek amacıyla kullanılan şeffaf ve yapışkan bir madde, Silikon
S, İşçilerin veya işverenlerin iş, kazanç, toplumsal ve kültürel konular bakımından çıkarlarını korumak ve daha da geliştirmek için aralarında kurdukları birlik, Sendika
S, Korunulacak, arkasına, altına veya içine girerek saklanılacak yer, Siper
S, Bir müzik parçasının bir kişi tarafından söylenmesi veya çalınması, Solo
S, Cıvatanın ucuna geçirilen, içi yivli demir başlık, Somun
S, İpin yanı sıra altın ve gümüş tellerle dokunan, kaftan ve giysi dikiminde kullanılan bir tür ipekli kumaş, Sündüs
S, Çiçeksiz bitkilerde üreme organı, Spor
S, Hızla fışkırtılan su yardımıyla pis su ile dışkıları atık su tesisatına akıtan düzenek, Sifon
S, Ticaret gemilerinde kaptanlık yapan kimse, Süvari
S, Çin dili, medeniyeti, tarihi vb. konuları inceleyen bilim dalı, Sinoloji
S, Tapınaklarda dinî tören eşliğinde üzerinde kurban kesilen, günlük yakılan taş masa, Sunak
S, Mızmız, sevimsiz, başkalarıyla ilişki kurmayan kimse, Sinameki
S, Besinlerin çeşitli enzimlerle eritilerek, parçalanarak ince bağırsakta emilebilir, kana karışabilir duruma gelmesi için uğradıkları fiziksel ve kimyasal değişikliklerin bütünü, Sindirim
S, Öğrencilerin veya bir işe girmek isteyenlerin bilgi derecesini anlamak için yapılan yoklama, Sınav
S, Ağaç, kumaş vb. yapılmış bir kanal içinde hareket ederek açılıp kapanan perde, Stor
S, Özel veya kamu kuruluşlarında belli bir makama, kişiye yardımcı olmak amacıyla haberleşmeyi sağlayan, yazışma yapabilen görevli, Sekreter
S, Vücudun içinde birikip dışarı atılamayan sıvıyı çekmek veya vücuda sıvı vermek için kullanılan araç, Sonda
S, Çoğunlukla askerî birliklere verilen yazı işlemeli, kenarları saçaklı ve gönderli bayrak, Sancak
S, Tarihi, kültürel veya arkeolojik güzellikleri nedeniyle devlet tarafından koruma altına alınan, yapılaşma ve değişiklik yapılması kısıtlanan veya yasaklanan alanlara verilen ad, Sit/Sit Alanı
S, Bir şeyi çekerek, esneterek uzatmak, Sündürmek/Sündürme
S, Halk şiirinde sevgi, doğa, güzellik konularını işleyen, genellikle koşma gibi kafiyelenen, sekizer hece ölçüsüyle yazılmış şiir, Semai
S, Özellikle elektrik devresinde, akım çok güçlü olduğunda eriyerek güvenliği sağlayan, kazayı önleyen nesne veya düzen, Sigorta
S, Bir şeyin veya bir kimsenin herhangi bir yönden ileride karşılaşabileceği zararı gidermek için önceden ödenen prim karşılığında bu işle uğraşan kuruluşla yapılan iki taraflı bağlantı sözleşmesi, Sigorta
S, İki taraf arasında bir sözleşmenin kurulmasına aracılık eden, komisyon karşılığında iş yapan kişi veya aracı kurum, Simsar
S, Karşılık beklemeden ihtiyaç sahiplerine verilen para ya da mal, Sadaka
S, Yahudilerin ibadet etmek, Tevrat okumak, din eğitimi almak ve cemaat işlerini yürütmek için bir araya geldikleri kutsal mekân, Sinagog
S, Dünya yüzeyinin yaklaşık 10-13 km üzerindeki troposfer ile 50 km'deki mezosfer arasında yer alan ikinci atmosfer katmanı, Stratosfer
S, Ham maddeleri işlemek, enerji kaynaklarını yaratmak için kullanılan yöntemlerin ve araçların bütünü, Sanayi
S, Herhangi bir varlığın düşük bir fiyattan alınarak daha yüksek bir fiyata satılması, vurgunculuk, Spekülasyon
S, Uygulamalara bağlı olmayan, deney ve tecrübe ile ispat edilmemiş, sadece düşünce planında kalmış saptırılmış bilgi, Spekülasyon
S, Çarpıcı, Sansasyonel
S, Kararlı, dengeli, değişmeyen, sağlam ve sabit, Stabil
S, Birkaç şeyi bir bütün meydana gelecek şekilde birleştirme, Sentez
S, Yapıların içinde, duvarların döşemeyle birleştiği yerde tabandan 10-15 santimetre yüksek, dışarıya çıkıntılı ağaç, mermer veya mozaik kuşak, Süpürgelik
S, Zurnanın çalınmak için ağıza alınan kamış kısmı, Sipsi
S, Gemici düdüğü, Sipsi
S, Duyularla ifade edilemeyen bir şeyi belirten somut nesne veya işaret, Simge
S, Değersiz metalleri altına çevirme, hastalıkları iyileştirme ve ölümsüzlük iksirini bulma arayışına dayalı, eski çağlarda deneme-yanılma yoluyla yapılan ilkel bir disiplin, Simya
S, Alınan yolun harcanan zamana oranı, Sürat
S, Doğramacılıkta kereste olarak kullanılan, sıkıştırılmış talaş ve yongadan yapılan tahta, Sunta
S, Toprağın kaymasını veya suyun akmasını önlemek için yapılan kalın duvar, Set
S, Masa tenisi, voleybol vb. oyunlarda maçın her bir bölümü, Set
S, Orkestra için bestelenmiş, birkaç bölümden oluşan uzun müzik eseri, Senfoni
S, Demir yollarında gündüz mekanik olarak kırmızı bir kolla, gece kırmızı ışıkla işaret veren alet, Semafor
S, Basketbolda yakın mesafeden topu sertçe potaya geçirme, Smaç
S, İstenmediği hâlde genel ağ ve sosyal medyada çok sayıda alıcıya aynı anda gönderilen gereksiz veya uygunsuz ileti, Spam
S, Bir dik üçgende belirli bir dar açının karşı dik kenar uzunluğunun hipotenüs uzunluğuna oranı, Sinüs
S, Bir hücrenin içini dolduran ve tüm organelleri içinde bulunduran hücre sıvısı, Sitoplazma
S, Yürürlükte bulunan antlaşmalara göre olması gereken veya süregelen durum, Statüko
S, Cambazların ve eğitilmiş hayvanların gösteri yaptıkları, genellikle kapalı yer, Sirk
S, Durgun, sakin olan, Sütliman
S, Kale duvarı, Sur
S, Salatalara, yemeklere ekşilik vermek için kullanılan ekşimiş üzüm, elma, limon vb. suyu, Sirke
S, Uluslararası Mors Alfabesinde acil durum sinyali, SOS
S, İnanç ve bilgiyi kiliseyle, özellikle Aristoteles'in bilimsel sistemini uyumlu bir biçimde birleştirmeye çalışan Orta Çağ felsefesi, Skolastik
S, Gerçekte yeri olmayıp zihinde tasarlanan, Sanal
S, Japon derebeyinin hizmetindeki savaşçı, Samuray
S, Resmî belgelerin kaydedildiği kütük, Sicil
S, Madenî paralara vurulan damga, Sikke
S, Öğle uykusu, Siesta
S, Masa, sini gibi şeylerin, yemek yemek üzere hazırlanmış durumu, Sofra
S, Toplum bilimi, Sosyoloji
S, Toplum bilimci, Sosyolog
S, Bir insan topluluğunu ulusal, dinsel vb. sebeplerle yok etme, Soykırım
S, Bir devlet büyüğünü veya önemli bir kişiyi plan kurarak öldürme, Suikast
S, Farklı türden iki veya daha fazla organizmanın birbirleriyle kurduğu yakın, uzun süreli ve doğrudan etkileşimli yaşam biçimi, Simbiyoz
S, Üstündeki şeyleri düşürmek veya temizlemek için bir şeyi kuvvetle sallamak, Silkmek/Silkme
S, Hücreyi inceleyen bilim dalı, Sitoloji
S, Matematikte atandıktan sonra değiştirilmeyen değer, Sabit
S, Sistem kaynaklarını diğer cihazlarla paylaşarak işlemleri gerçekleştiren bilgisayar, Sunucu
S, Boksörlerin kütlesine göre yapılan kategorilendirme, Siklet
S, Hz. Muhammed'in doğumundan vefatına kadar hayatını konu alan ilim, Siyer
S, İsimlerin önüne gelerek onları renk, şekil, durum gibi yönlerden niteleyen ya da işaret, sayı, soru, belgisizlik gibi yönlerden belirten sözcük türü, Sıfat
S, Bir kimseye, bir davranışının ya da bir sözünün üzüntü, alınganlık, kırgınlık gibi duygular uyandırdığını yumuşak bir biçimde belirtme, Sitem
S, Araçların arka kısmında bulunan, fren pedalına basıldığında kırmızı renkte yanarak arkadaki sürücülere yavaşlama veya durma niyetini bildiren güvenlik aydınlatması, Stop Lambası
S, Mecaz anlamda bir durumun insan üzerinde bıraktığı olumsuz etki, Sendrom
S, Bir hastalık sonucu vücutta ortaya çıkan belirti, Semptom
S, Önceden tespit edilen bir alanda konuşmacıların bildiri sunarak katıldığı bilimsel toplantı, Sempozyum
S, Bir otomobil şasisinin yayla sağlanmış esnekliği, Süspansiyon
S, Bir katının bir sıvı içinde çözünmeden, küçük parçacıklar halinde asılı kalarak dağılmasıyla oluşan heterojen karışım türü, Süspansiyon
S, Bir satış yerinde satışa hazır bulundurulan malların tümü, Stok
S, Toptancıdan bir malı çok miktarda veresiye aldıktan sonra piyasada değerinden daha aşağıya peşin olarak satma, Spot
S, Şeytana tapma, Satanizm
S, Kayak sporunda bayraklarla işaretlenmiş birtakım dönemeçlerden oluşan pist üzerinde yapılan bir yarış türü, Slalom
S, Bir etkinliği, kişiyi, kurumu veya projeyi maddi ya da ayni destekleyerek, bunun karşılığında marka bilinirliğini artırma veya reklam yapma amacı güden kişi veya kuruluş, Sponsor
S, Beklenmeyen, herkesin duygularını incitecek utanç verici çirkin durum veya olay, Skandal
S, Bir hedefe ulaşmak için önceden yapılan plan ve buna uygun hareket, tutulan yol, Strateji
S, -1’in kare köküne eşit olduğu kabul edilen ve +i veya -i ile gösterilen sayı birim, Sanal Sayı
S, 1 gramın yüzde biri, Santigram
S, Futbol sâhasının tam orta yerini göstermek üzere etrâfına bir dâire çizilmiş olan merkez noktası, orta yuvarlak, Santra
S, Su, ısı, rüzgâr, nükleer enerji vb. enerjiler kullanılarak elektrik üretilen tesis, Santral
S, Kalbin ve diğer organların seslerinin iyice duyulmasını sağladığı için hekimlerin hasta muâyenesinde kullandıkları âlet, Stetoskop
S, Devletlerin diplomatik ilişkilerini keserek giriştikleri silahlı mücadele, Savaş
S, Karaciğerin salgıladığı yeşil sarı renkte acı sıvı, öd, Safra
S, Balonlarda yükselmeyi veya inişi ayarlamak için pilotların attığı ağırlık, Safra
S, Kurnazlığa aklı ermeyen, içinde fesatlık olmadığı için kolayca aldatılabilen kimse, Saf/Saftirik/Saftaron/Saftorik
S, İçine temizliğini bozacak bir şey karışmamış olan, temiz, duru, berrak, Saf
S, Yaygın duruma gelip tesir etme, etkisi altına alma, Sirayet/Sirayet Etme/Sİrayet Etmek
S, Osmanlılarda kapı kulu teşkilatındaki atlı asker, Sipahi
S, Alevi ve Bektaşilerin cem törenlerinde on iki hizmetten biri olarak, müzik ve nefesler eşliğinde ilahi aşkla kadınlı erkekli dönerek yaptıkları kutsal dans, Semah
S, Genellikle ülke dışına yapılan askerî harekât, savaş için yapılan yolculuk, Sefer
S, Bir ülkenin silahlı kuvvetlerini savaşa hazır duruma getiren, ülkenin ekonomisini, yönetimini savaş gereklerine uyacak duruma sokan hazırlık ve önlemlerin tümü, Seferberlik
S, Söylenen sözleri söylendiği kadar çabuk yazmaya elverişli, kısa ve yalın işaretlerden oluşan yazı yöntemi, Steno/Stenografi
S, Pişmiş toprak, plastik vb.nden yapılan, çiçek yetiştirmekte kullanılan kap, Saksı
S, Geleneksel Yunan danslarından Hasapiko'nun yavaş ve hızlı ritimlerinin birleşimiyle oluşan, omuz omuza veya el ele tutuşularak yavaş başlayıp hızlanan adımlarla oynanan Yunan halk dansı, Sirtaki
S, Yoksulluk içinde olan, Sefil
S, Victor Hugo tarafından kaleme alınan ve dünya edebiyat tarihinin klasiklerinden biri kabul edilen, bir somun ekmek çaldığı için 19 yıl kürek mahkûmiyeti çeken Jean Valjean'ın, hapisten çıktıktan sonra yaşadığı toplumsal dışlanma, vicdani dönüşüm ve dürüst bir insan olma mücadelesini anlatan roman, Sefiller
S, Erkeklerin yarı resmî gece ziyâfetlerinde, balolarda giydikleri, genellikle ceketi atlas yakalı elbise, Smokin
S, Bir maldan yapılan ilk satış veya günün ilk alışverişi, Siftah
S, Sahnedeki oyunculara, izleyicilere duyurmadan unutulmuş bir sözü veya cümleyi hatırlatma, Sufle
S, Un, şeker, yumurta, çikolata, süt ve tereyağının muhallebi kıvamına gelinceye kadar çırpılıp pişirilmesiyle yapılan, dışı kek kıvamında, içi akışkan bir tür tatlı, Sufle
S, Futbol, voleybol vb. karşılaşmalarında oyun başlamadan önce takımların hakemler eşliğinde yan yana dizilerek seyircileri ve birbirlerini selamlaması, Seremoni
S, İtfaiye, ambulans ve polis araçlarında bulunan, tiz ses çıkaran uyarıcı alet, Siren
S, Eş zamanlı, Senkron
S, Afrika’da yerlilerin oturduğu yerlerde kafile hâlinde yapılan vahşi hayvan avı, Safari
S, At bakımı ile görevli olan, at tımar eden kimse, at bakıcısı, Seyis
S, Şili'nin başkenti, Santiago
S, Genellikle camilere bitişik özel bir biçimde yapılmış, karşılık beklemeden hayır için içme suyu dağıtılan taş yapı, Sebil
S, Benzer ürünler üreten veya hizmetler sunan işletmelerin oluşturduğu ekonomik faaliyet kolu veya iş alanı, Sektör
S, Bir kuruluşta hesap işlerine bakan kimse, Sayman
S, Geçmişte işlenmiş, mahkemece ispatlanıp cezalandırılmış olan suç, Sabıka
S, Mağaraların tavanında aşağıya doğru oluşan, genellikle koni biçiminde kalker birikintisi, Sarkıt/Stalaktit
S, Müslümanları bayram veya cuma namazına çağırmak, bazı yerlerde cenaze için kılınacak namazı haber vermek amacıyla minarelerde okunan dua, Sela
S, Bir kimseyle karşılaşıldığında, birinin yanına gidildiğinde veya yanından uzaklaşıldığında kendisine söz ve işaretle bir nezaket gösterisi yapma, Selam/Selamlama/Selamlamak
S, Atmosferde bir alçak basınç alanı çevresinde hızla dönen rüzgârların oluşturduğu şiddetli fırtına, Siklon
S, Bir dakikanın altmışta biri olan zaman birimi, Saniye
S, Bir saniyenin altmışta biri olan zaman dilimi, Salise
S, Uzun süre bozulmadan saklamak amacıyle içine et, balık, peynir vb. yiyeceklerin konulduğu tuzlu su ve yiyecekleri bu suya koyma işi, Salamura
S, Yemek odası, Salamanje
S, İki nöronun veya nöronla başka bir hücrenin bağlandığı yer, Sinaps
S, Kimyasal reaksiyonlara karşı ilgisiz elementler, Soy Gaz/Soy Gazlar
S, Üzerine yazı yazılan veya basılan bir kâğıt yaprağın iki yüzünden her biri, Sayfa/Sahife
S, Kısa sürede insanlarla kaynaşıp dost olabilen, kendini çabucak sevdiren, Sokulgan
S, Evlere, çeşmeden su taşımayı iş edinmiş olan kimse, Saka
S, Çekinilmesi, dikkatli olunması gereken durum, mahzur, Sakınca
S, İki uçlu çatal biçimindeki dalların uçlarına lastik ve lastiklerin arasına da geniş bir meşin parçası bağlı bulunan araç, Sapan
S, Ana yoldan ayrılan bir yolun başlangıç noktası, Sapak
S, Rakibin bedenini kollarıyla birlikte kavrayarak yana veya arkaya savurma, devirerek bastırma biçiminde uygulanan bir güreş oyunu, Salto
S, İçinde yabancı bir öge bulunmayan, mutlak, Salt
S, Arkalıksız, üstü minderli ve yastıklı olabilen, oturmaya veya yatmaya yarayan ev eşyası, divan, Sedir
S, Bir konu ile ilgili bilgi vermek ve bu bilgiler üzerinde tartışmak amacıyla birkaç yetkilinin yönetimi altında düzenlenen toplantı, Seminer
S, İçten, yapmacıksız, Samimi
S, Ölen kimsenin meziyetlerini, fazîletlerini, iyiliklerini sayarak söylenen ağıt, Sagu
S, Mecaz anlamda yeni, kullanılmamış anlamına gelen bir sıfat, Sıfır
S, Kendi başına değeri olmayan, ondalık sayı sisteminde sağına geldiği rakamı on kere büyüten işaret, Sıfır
S, Topla yapılan yaylım ateşi, Salvo
S, Mevlevi dervişlerinin ney, nısfiye vb. çalgılar eşliğinde, kollarını iki yana açıp dönerek yaptıkları ayin, Sema
S, Semada dönen derviş, Semazen
S, Gama ışını yayan radyoaktif bir izotopun organizma içindeki yolunu izlemek temeline dayanan tanı yöntemi, Sintigrafi
S, Futbol karşılaşmalarının, atletizm yarışmalarının, bazı tören ve gösterilerin yapıldığı, seyirciler için çevresinde tribünleri, alt katında sporculara mahsus soyunma odaları, duşlar vb. bulunan spor tesîsi, Stadyum
S, Durağan bir nokta çevresinde ağırlığının etkisiyle serbestçe salınım yapan cisim, Sarkaç
S, Katışıksız olarak ırkının bütün özelliklerini taşıyan at, Safkan
S, Biriyle alay etmek veya birini sinirlendirmek amacıyla kullanılan hicivli ifade, Sarkazm
S, Bir tabloda düşey durumdaki yüzey, Sütun
S, Hava gazı, elektrik, su vb.nin kullanılan miktarını veya mekanik etkilenmeleri ölçen alet, Sayaç/Saat
S, Kur'an'ın yüz on dört bölümünden her biri, Sure
S, Üzerine yatak ve minder konularak hem oturmaya hem yatmaya yarayan, genellikle yaylı olan, demir vb. malzemeden yapılmış yatak altlığ, Somya
S, Dil birimlerinin birbirleriyle ilişkiye girerek anlamlı ve işlevli bir birim oluşturacak bir biçimde art arda sıralanması durumu, Sentagma
S, Cümleler oluşturulurken kelime veya kelime gruplarının bir araya geliş kurallarını inceleyen dil bilgisi kolu, Sentaks
S, Boş, temelsiz, asılsız söz, Safsata
S, Halka biçiminde, genellikle üzerine susam serpilmiş çörek, Simit
S, Yazma ve basma eserler alıp satan kitapçı, Sahaf
S, Kitap indirilmeyen peygamberlere gelen Allah'ın emirleri, Suhuf
