letter, question, answer
F, Ağır hidrojen atomlarının birleşip helyum atomu meydana getirirken aynı zamanda çok aşırı ısı çıkarması olayı, Füzyon
F, Saat, mikroskop vb. araçları tozdan korumak için üzerlerine kapatılan, yarım küre biçiminde cam kap, Fanus
F, Şiddetle esen ve şiddet derecesine göre karada ve denizde etrâfı birbirine katarak bâzan can ve mal kaybına sebep olabilen sert rüzgâr, Fırtına
F, Belirli bir coğrafi alanda bulunan bitki türlerinin tümü, Flora
F, Belirli bir coğrafi alanda bulunan hayvan türlerinin tümü, Fauna
F, Yeşil bitkilerin, güneş enerjisi ve klorofil pigmenti yardımıyla karbondioksit ve sudan besin maddelerini üretmesi, Fotosentez
F, Elektromanyetik ışık enerjisinin ölçülebilen en küçük birimi, Foton
F, Yüzü ve görünüşü fotoğraf veya sinema filminde çok güzel çıkan kimse, Fotojenik
F, Tavukların yumurtlaması için hazırlanmış özel yer, Folluk
F, Sopa vurmak için ayak tabanlarını uygun bir biçimde sıkıştırıp tutmak üzere iki ucuna bağlı bir ipi olan cezalandırma aracı, Falaka
F, Ölümlü, Fani
F, Şapka yerine kullanılan, kırmızı, kalın çuhadan yapılmış, tepesinde püskülü olan, silindir biçiminde başlık, Fes
F, İki sâhil arasında karşıdan karşıya otomobil, kamyon, vagon vb. şeyler taşıyan gemi, araba vapuru, Feribot
F, Bir alacağın ödenmesi için borçlunun parasına, aylığına veya malına icra dairesi tarafından el konulması, Filiz
F, Kısa bilgileri içeren belge, Föy
F, Gösterişli ve iddiâlı şekilde başlanan bir işte uğranan başarısızlık, Fiyasko
F, Deniz seviyesinin yükselmesi sonucunda dar ve uzun körfeze dönüşen buzul vadisi, Fiyort
F, Kurdele, şerit, kumaş vb.nin kelebek şeklinde bağlanmış biçimi, Fiyonk/Fiyongo
F, Donanma, şenlik ve işâretleşmelerde kullanılan, havaya atıldığında çeşitli renk ve şekiller alan, yanıcı veya patlayıcı madde, Fişek
F, Bir işi en iyi bilen, en iyi yapan kimse, üstat, Feriştah
F, Parmak uçlarıyla yapılan hafif vuruş, Fiske
F, Giysi, çanta vb. yerlerde kullanılan, karşılıklı dişler ve bunların üzerinde yürüyen kapatıcıdan oluşan düzenek, Fermuar
F, Futbolda görevi karşı tarafa top sürmek ve gol atmak olan ileri uçtaki oyuncu, Forvet
F, Ahlakın övdüğü iyi olma, alçak gönüllülük, yiğitlik, doğruluk vb. niteliklerin genel adı, erdem, Fazilet
F, Yazı karakteri, Font
F, Yaş duvar sıvası üzerine kireç suyunda eritilmiş madenî boyalarla resim yapma yöntemi, Fresk
F, Keten dövmeye yarayan tokmak, Filariz
F, Tavuk, balık, dana ve kuzu etlerinin kemiklerinin veya kılçıklarının çıkartılarak dilimlere ayrılmış parçası, Fileto
F, Ağır cisimleri bir yerden bir yere kaydırmak ve özellikle deniz teknelerini karaya çekmek için bunların altına sürülen yuvarlak ağaç, Filenk
F, İnsansever, insanların iyiliği için çalışan kimse, Filantrop
F, Kapılara, pencerelere veya evlerin iç bölümlerine süsleme amacıyla yapılıp takılan dövme demir, Ferforje
F, Belli zamanlarda, belli yerlerde ticari mal sergilemek ve satmak amacıyla açılan büyük sergi, Fuar
F, Tütsü ile kurutulmuş balık ya da et, Füme
F, Öğrencilerin, sporcuların, bazı mesleklerde çalışanların giydikleri, bağlı bulundukları okul, spor kulübü veya meslekleri belirten tek tip giysi, Forma
F, Çok belirli ve kendilerine özgü ortak özelliklerinden dolayı bir arada değerlendirilen cinsler topluluğu, Familya
F, Yüklü geminin bordasındaki su düzeyi ile boş geminin bordasındaki su düzeyi arasında kalan bölüm, Faça
F, İskambil destesinin en altındaki kâğıt, Faça
F, Yüzdeki bıçak yarası, Faça
F, Yeni yetişen ağaç, Fidan
F, Çoğunlukla kendine benzeme veya oransal kırılma özelliği gösteren karmaşık geometrik şekillerin ortak adı, Fraktal
F, Göz için; parlaklık, aydınlık, nur, Fer
F, Çeşitli şeylere bakarak gelecekte olacaklar hakkında anlamlar çıkarma, gaipten haber verme, Fal

G, Bir maddenin en küçük tanesi, Granül
G, Yazılım projelerini tutan popüler versiyon kontrol sistemi, Git
G, Kırım hanlarına verilen ünvan, Giray
G, Savaştan sağ olarak dönen kimse, Gazi
G, Bir yerleşim bölgesinin, aynı şehir, ülke veya kültürden gelen insanların yerleştiği bölümü, Getto
G, İnek sütünden yapılan, sert yapılı, açık sarı renge sahip ve gözenekli bir peynir, Gravyer
G, Genellikle Venedik'te kullanılan, ayakta, kıç tarafta tek kürekle yürütülen, 10 metre uzunluğunda, yassı ve iki başı yukarıya kıvrık kayık, Gondol
G, Bir iletkenin uçları arasındaki gizil güç farkı, potansiyel farkı, voltaj, Gerilim
G, Doğup yaşanılmış olan yerden uzak yer, Gurbet
G, Kamıştan yapılmış çift düdük ve tulumdan oluşan, tiz sesli, nefesli, İskoçların millî çalgısı, Gayda
G, Ölü yıkama yeri, Gasilhane
G, Müzik eserlerinin yazılı metni, Güfte
G, Yüzüne bakılmayacak kadar sevimsiz ve çirkin, Gudubet
G, Argoda karısının veya bir kadın yakınının ihanetine uğramış erkek, Geyik
G, Yapılması veya söylenmesi hoş kaçmayan yersiz ve zamansız davranış veya söz, Gaf
G, Yemek yenilen, gösteri izlenen, müzik dinlenen, bazen oyun sergilenen eğlence yeri, Gazino
G, İslam dinini korumak veya yaymak amacıyla Müslüman olmayanlara karşı yapılan kutsal savaş, Gaza
G, Bir şeye veya bir kimseye özgü olmayıp onun bütün benzerlerini içine alan, Genel
G, Orta Çağ'a özgü, Gotik
G, Bir kamu kuruluşunu veya özel kuruluşu yöneten kimse, Guvernör
G, Tuhaflık, alışılmadık, yadırganacak durum veya anormal özellik, Garabet
G, Futbolda topun kale çizgisini geçmesiyle kazanılan sayı, Gol
G, Çin, Japonya, Kore vb. Uzak Doğu ülkelerinde yetişen, geleneksel tedavilerde kullanılan, kazık köklü, otsu ve çok yıllık bir bitki, Ginseng
G, Boyundaki troit bezinin aşırı büyümesiyle beliren hastalık, Guatr
G, Görünüşe göre, sanılır ki, anlaşıldığı gibi anlamında bir zarf, Galiba
G, Boy abdesti, Gusül
G, Değişik şartlara bağlı olarak belli bir yöre içinde çadır, hayvan ve öteki araçlarla yer değiştiren, yerleşik olmayan kimse veya topluluk, Göçebe
G, Devletin koyduğu kurallar dışında kalan, Gayrıresmi/Gayr-ı Resmi
G, Yasa dışı işler yapan çete üyesi, Gangster
G, Almanya'da Hitler döneminde kurulan gizli, siyasi polis örgütü, Gestapo
G, Makine yağı, Gres/Gres Yağı
G, Alay edilecek durumda olan, Gülünç
G, Et veya balık gibi asıl yemeğin yanına eklenen sebze, patates vb. yiyecekler, Garnitür
G, Yandan kulplu, boynu uzun, genellikle bakırdan su kabı, Güğüm
G, Mecaz anlamda bir sözü tam olarak ve açıkça söylememek, Gevelemek/Geveleme
G, Kolayca kırılıp ufalanan anlamına gelen bir sıfat, Gevrek
G, Hayvan veya hayvan sürüsünü önüne katıp otlatmak, Gütmek/Gütme
G, Bir şey anlatmaya başlamadan önce sözü asıl konuya getirmek için söylenen giriş sözleri, Girizgah
G, Elazığ yöresine ait, "kardeş", "ağabey", "dost" ve "yiğit delikanlı" anlamlarına gelen sevgi ve samimiyet içerikli bir hitap sözü, Gakkoş
G, Demir veya çelik malzemelerin korozyona karşı korunması amacıyla, yaklaşık 450 °C sıcaklıktaki erimiş çinko banyosuna daldırılarak yüzeylerinin çinko ile kaplanması işlemi, Galvaniz
G, Vücudun omuzlarla baş arasında kalan ön bölümü, Gerdan
G, Savaşta düşmandan zorla ele geçirilen mal, Ganimet
G, Düşük çözünürlüklü ve kısa, döngüsel hareketli görüntüleri destekleyen, internette yaygın kullanılan bir 8-bit resim dosyası formatı, Gif/GIF
G, Canlıların özelliklerinin nesilden nesile nasıl aktarıldığını, genlerin yapısını, işlevini ve çeşitliliğini inceleyen biyoloji dalı, Genetik
G, Bir konuda güvence veren ve bunun gerçekleşmesini gözeten ve denetleyen kimse veya kuruluş, Garantör
G, Sayısal verilerin çizgiler, semboller veya şekiller kullanılarak görsel bir düzlemde ifade edilmesi, Grafik
G, habersiz ve hazırlıksız olduğu, beklemediği bir sırada bastırıp istemediği bir duruma düşürmek, Gafil
G, Meyve esansı, şeker ve karbon asidi ile yapılan, basınçlı hava ile şişelere doldurularak hazırlanan içecek, Gazoz
G, Saydam olmayan bir cisim tarafından ışığın engellenmesiyle ışıklı yerde oluşan karanlık, Gölge
G, Çimenlerle kaplı, açık, geniş bir alanda, ufak bir topu özel sopalarla ilerleterek belli bir deliğe sokma amaçlı oynanan oyun, Golf
G, Suyun dönerek ve çukurlaşarak oluşturduğu alan, Girdap
G, Hinduizm'in kutsal nehri, Ganj/Ganj Nehri
G, Trafikte araçların köprü, tünel ve üst geçit gibi yapılardan güvenle geçebilmesi için belirlenen maksimum yükselik, genişlik ve uzunluk ölçüleri, Gabari
G, İşçilerin ekonomik ve sosyal haklarını korumak, iyileştirmek veya çalışma koşullarını düzeltmek amacıyla, aralarında anlaşarak topluca işi bırakmaları ve işyerinde faaliyeti durdurmaları eylemi, Grev
G, Sanat eserlerinin veya herhangi bir malın sergilendiği salon, Galeri
G, Otomobil alınıp satılan yer, Galeri
G, Sır, Gizem
G, Erkek veya dişi üreme hücresi, cinsiyet hücresi, Gamet
G, Eski Roma’da seyircileri eğlendirmek için arenada bir şahısla veya vahşi hayvanlarla öldüresiye dövüşen kimse, Gladyatör
G, Uzayda milyonlarca yıldızdan, bulutsulardan, gaz bulutlarından oluşan ve ayrı bir sistem teşkil eden gök cisimleri topluluğu, Galaksi/Gök Ada
G, Verimi arttırmak için toprağa karıştırılan hayvan dışkısı, çürümüş organik veya kimyevî madde, Gübre
G, Çocukluklarından îtibâren eğitime tâbi tutularak müzik, şiir, konuşma sanatı, geleneğe uygun şekilde çay hazırlayıp sunma gibi hususlarda yetiştirilmiş olan ve çay evlerinde çalışıp kazandıkları bu meziyetlerle gelenlerin iyi vakit geçirmelerini sağlayan Japon kadınlarına verilen isim, Geyşa
G, Belden aşağıya, yüze ve boğaza dokunulmadan yapılan, kuralları buna göre konmuş olan güreş, Grekoromen
G, Eski Yunanca, Grekçe
G, Gemilerde, tekne boyunca yatay olarak, sürekli ya da kesik biçimde, tahtadan ya da sac levhadan yapılan, yük ve yaşama yerlerinin tabanını oluşturan ya da üstünü örten yüzey, Güverte
G, Tiyatro, sinema, park, fuar, vapur, tren vb. biletle girilen yerlerde giriş biletlerinin satıldığı yer, Gişe
G, Çok ve yerli yersiz konuşan, çenesi düşük kimse, Geveze
G, Bir arsa veya arâzi üzerine izinsiz olarak gizlice ve çabucak yapılıveren kaçak yapı, Gecekondu
G, Halk ağzında klarnet, Gırnata
G, Bir filmin genellikle resmi elbise ile gidilen ve dâvetliler huzurunda yapılan ilk oynanış veya gösterilişi, Gala
G, Mutfak ve yemek konusundaki bilgilerin tümü, yemek sanatı, Gastronomi
G, Sindirim sisteminin fizyolojisini ve hastalıklarını inceleyen bilim dalı, sindirim bilimi, Gastroenteroloji
G, Lokanta, yemekhane vb.nin büyük mutfaklarında malzemelerin yıkanması, karıştırılması, saklanması vb. için kullanılan, dört köşe, metal veya plastikten yapılan küvet biçiminde kap, Gastronorm
G, Yemek borusu, mide ve on iki parmak bağırsağının gözle görülmesini sağlayan, hastaya ağız yolu ile uygulanan fiberoptik alet, Gastroskop
G, Damak zevki olan, ağzının tadını bilen, iyi yemekten anlayan kimse, Gastronom
G, Mîde iç zarı iltihabı, Gastrit
G, Politika, ekonomi, kültür ve daha başka konularda haber ve bilgi vermek için yorumlu veya yorumsuz, her gün veya belirli zaman aralıklarıyla çıkarılan yayın, Gazete
G, Yağ bağlamış karın, Göbek
G, Karanlık ve ıssız yerlerde, insanın gördüğünü sandığı korkunç hayalet, Gulyabani
G, Birim zamanda harcanan enerji, Güç
G, Süt vb. şeyler koymaya, hayvanlara yem vermeye yarayan kova biçiminde tahta veya deriden kap, Gerdel
G, Hapishanede mahkûmlara bekçilik etmek ve yasalara uygun davranmalarını sağlamakla görevli kimse, Gardiyan
G, Giysi dolabı, Gardırop
G, Kurtçuğu yünlü kumaş ve dokuma yiyen pul kanatlı böcek, Güve
G, Ay ve Güneş'in yer yuvarlağı üzerindeki çekim güçleri sebebiyle deniz yüzünde, özellikle ana denizlerde su düzeyinin alçalması, kabarması olayı, Gelgit
G, Sinirlerde ve lenf damarlarında yer yer ortaya çıkan yuvarlak şişlik, Gangliyon
G, Kara ve hava kuvvetlerinde albaylıktan sonra gelen ve mareşalliğe kadar olan yüksek rütbeli subaylara verilen genel ad, General
G, Antik Mezopotamya'da ortaya çıkan, Uruk Kralı Gılgamış'ın en yakın dostu Enkidu'nun ardından girdiği ölümsüzlük arayışını ve insanın ölümlülük gerçeğiyle yüzleşmesini anlatan, dünya tarihinin bilinen en eski yazılı edebiyat eseri, Gılgamış/Gılgamış Destanı
G, Nokta, çizgi, açı, yüzey ve cisimlerin birbirleriyle ilişkilerini, ölçümlerini, özelliklerini inceleyen matematik dalı, Geometri
G, Düşünceden çok, canlı duygulara ve aşka dayanan sanat eseri, Garami

H, Tütün kıyma makinesi, Havan
H, İşe yaramayacak derecede bozulmuş, zarar görmüş, Hurda
H, Saray ve konaklarda kadınlara ayrılan bölüm, selamlık karşıtı, Harem
H, Yaşlanmış kimselerin bakımlarının yapıldığı ve barındığı kurum, Huzurevi
H, Suları aynı deniz, göl veya nehre akan, dağ veya tepelerle sınırlanmış kara parçası, Havza
H, Güneybatı Afrika’da yaşayan ilkel bir boy, Hotanto
H, Kiremit ve tuğla tozlarının kireç ve su ile karıştırılmasından elde edilen bir harç türü, Horasan
H, Zevki için para harcamaktan kaçınmayan kimse, Hovarda
H, İnsanın yaradılış ve ruh özelliklerinin, eğilimlerinin ve içgüdülerinin bütünü, Huy
H, Arap alfabesiyle güzel yazı yazma sanatı ve bu biçimde yazılmış yazı, Hat
H, Telgraf, telefon, televizyon gibi cihazlarda iletişim sağlayan yol, Hat
H, Bir ulaşım aracının tâkip ettiği yol, Hat
H, Verilen karara göre, karar gereği anlamına gelen bir zarf, Hükmen
H, Toprağı kazma, kazı, Hafriyat
H, Şanlıurfa'nın "Batık Şehir" olarak da anılan ilçesi, Halfeti
H, Cennette yaşadığına inanılan dişi varlık, Huri
H, Silahlı soygun yapan, yol kesen kimse, Haydut
H, İçine mürekkep konulan küçük kap, Hokka
H, El çabukluğu ile birtakım şaşırtıcı olaylar yapmayı meslek edinen kimse, Hokkabaz
H, İki farklı türün, teknolojinin veya enerji kaynağının bir araya getirilerek tek bir yapıda kullanılması, melez, Hibrit
H, Etkili söz söyleme sanatı, Hitabet
H, Genellikle mersin balığının salamura edilmiş yumurtası; balık yumurtası, Havyar
H, İstemeyerek ve bilmeyerek yapılan yanlış, Hata
H, Uçak, araba, tarım aracı vb. nesneleri barındırmaya yarar kapalı yer, Hangar
H, Ayrışık, homojen zıttı, Heterojen
H, Doğru bir çizgi üzerinde bulunma durumu, Hiza
H, Bir topluluk, kongre vb. yerlerde katılanları ağırlayan, onlara kılavuzluk eden erkek, Host
H, Bir cismin uzayda doldurduğu boşluk, Hacim
H, Kur'an'ın her cüzünün beş sayfalık bölümü, Hizip
H, Bağış, Hibe
H, Dışarıdan gerçek bir uyarıcı olmadığı halde, kişinin 5 duyu organından biri veya birkaçı aracılığıyla gerçek dışı görüntüler, sesler, kokular, tatlar veya dokunuşlar algılaması, Halüsinasyon
H, Daha ziyade gençlerin ve araştırmacıların konaklaması için yapılmış ve belirli kurallara göre yönetilen ucuz tesis, Hostel
H, Uçaklarda yolcu ağırlayan kadın, Hostes
H, Fanatizmden beslenen, aşırı davranışlarda bulunan ve çevreye zarar vermeye eğilimli taraftar, Holigan
H, Dinleyenleri etkilemek veya heyecanlandırmak amacıyla yapılan abartılı anlatım, Hamaset
H, İnsanlara, evlere veya tarım ürünlerine zarar veren, rahatsızlık uyandıran küçük böcekler, eklem bacaklılar ve bazı küçük canlıla için kullanılan terim, Haşere
H, Gerçekle bağı kopmuş, mantıkla düzeltilemeyen, ikna edilemeyen yanlış ve sabit inançlar ile sayıklama veya saçmalama durumu, Hezeyan
H, Elektrik dalgalarını ses dalgasına çeviren ve gerektiğinde sesi yükseltmeye yarayan alet, Hoparlör
H, Kadın için kullanılan adlandırmalardan sonraya getirilen saygı sözü, Hanım
H, Elinde bulunduran, üzerinde taşıyan, Hamil
H, İslamiyet’ten önceki dinlerden kalan veya dinde olmadığı hâlde sonradan oluşturulmuş, gerçekle ilgisi bulunmayan batıl inanç, Hurafe
H, Toplumu düzenleyen ve devletin yaptırım gücünü belirleyen yasaların bütünü, Hukuk
H, Cuma namazından önce ve bayram namazından sonra hatibin minberde yaptığı öğüt niteliğindeki konuşma, Hutbe
H, Bir şehrin veya önemli bir yerin korunması için taştan yapılmış, yüksek duvarlı ve kuleli, çevresinde hendekler bulunan küçük kale, Hisar
H, Hz. Muhammed'in vekili olarak Müslümanların imamlığını ve din koruyuculuğunu yapmakla görevli kimse, Halife
H, Bütün veya dilimler hâlindeki kuru meyvenin şekerli suyla kaynatılmasıyla yapılan tatlı içecek, Hoşaf
H, Ödenecek ücretin dökümünü ve tutarını gösteren kâğıt, Hesap
H, Bir durumun beğenildiğini göstermek için “Bravo, aferin” anlamında kullanılan bir ünlem, Helal
H, Mecaz anlamda nikahlı eş, Helal
H, Din kurallarına aykırı olan, dinî bakımdan yasak olan, Haram
H, Bir şeyden duyusal veya manevi sevinç duyma, Haz
H, Karaciğerin anatomisini, fizyolojisini ve hastalıklarını inceleyen bilim dalı, Hepatoloji
H, Vücudun aşırı soğuğa maruz kalması sonucu vücut sıcaklığının 35°C'nin altına düşmesi, Hipotermi
H, Başka şirketlerin hisselerini elinde bulundurarak onların yönetimini ve denetimini üstlenen bir şirketler topluluğu, Holding
H, Tahıl tanesi, Habbe
H, Makamların, rütbelerin önem sırası, astlık ve üstlük düzeni, aşama gözetilerek yapılan sınıflama, Hiyerarşi
H, Antik Mısır dönemine ait resimli yazı sistemi, Hiyeroglif
H, Normalin üzerinde hareketli olan kimse, Hiperaktif
H, Karadeniz Bölgesi'nde kemençe ile oynanan halk oyunu, Horon
H, Karşılıklı konuşma, sohbet, Hasbihal
H, Gerçekleşmesi özlenerek zihinde kurulan ve insanı oyalayıp avutan tatlı hayal, Hülya
H, Ayın ilk günlerinde aldığı yay biçimi, Hilal
H, Buluşan kimseler arasında, buluşmanın ilk dakikalarında, hatır sormak için söylenen ilk sözler, Hoşbeş
H, Yol üzerinde veya kasabalarda yolcuların konaklamalarına yarayan yapı, Han
H, Eski Türk-Moğol topluluklarında hükümdar, Han
H, Bir ucu kıvrık sopalarla çayır veya buz üzerinde iki takım arasında oynanılan top oyunu, Hokey
H, Erkeklik bezleri çıkarılmış veya köreltilmiş erkek, Hadım
H, Babasını öldüren amcasından intikam almak isteyen Danimarkalı bir prensin hikayesini anlatan William Shakespeare'in ünlü oyunu, Hamlet
H, Babanın kız kardeşi, Hala
H, Hava basıncıyla çalışan, beton kırıcı, delici alet, Hilti
H, Büyük bir ihtimalle anlamında kullanılan bir zarf, Herhalde
H, Bir kişinin doğduğu anda doğduğu yerdeki gökyüzü konumunu gösteren iki boyutlu harita, doğum haritası, Horoskop
H, Aynı soydan gelen hükümdarların veya soylu kişilerin oluşturduğu köklü, güçlü ve nüfuzlu aile
H, Bir şeyi elde etmek için duyulan aşırı, doymak bilmeyen istek, tutku ve açgözlülük, Hırs
H, Herhangi bir durumu safça kendinden yana iyiye yorma, Hüsnükuruntu
H, Kendilerini halktan ayrı ve üstün sayan, kendilerinde bir tür ayrıcalık gören kimseler, Havas
H, Bir dik üçgende, dik açının karşısında bulunan kenar, Hipotenüs
H, Başkalarının sahip olduğu imkânları kıskanma, Haset
H, Kanamayı durdurmak için vücudun ihtiyaç duyduğu kanı pıhtılaştırma yeteneğini bozan, kalıtsal bir hastalık, Hemofili
H, Sonradan gelen ve birinin yerine geçen kimse, Halef
H, İki ağaç veya direk arasına kurulan ağ yatak, Hamak
H, At yarışları yapılan alan, Hipodrom
H, Hz. Muhammed’den sonra onun vekîli, din ve dünya işlerinde bütün müslümanların önderi, aynı zamanda devletin başı olan zâtın görevi ve makāmı, Hilafet/Halifelik
H, Zihinde canlandırma yeteneği, Hayal Gücü
H, Yunan târih ve kültürüyle ilgili, Yunan medeniyetinin etkisiyle oluşan, Helenistik
H, Bir nesnenin üç boyutlu gerçek kaydı, Hologram
H, Evlerde oda kapılarının açıldığı genişçe yer, Hol
H, Beklenenin, umulanın elde edilememesinden doğan acı, mahrûmiyet acısı, beklenene erişememekten doğan hüzün, Hüsran
H, Sert plastikten büyük çember şeklinde yapılan, vücudun bel ve basen bölgesinde çevrilerek kullanılan oyuncak, Hulahop
H, Yer altı ve yer üstü sularının nicelik, miktar ve tedâvi hassası gibi çeşitli hususlarını inceleyen bilim dalı, su bilimi, Hidroloji
H, Toplum düzenine karşı çıkan, temel kurumlara başkaldıran, katı kurallardan kurtulup geniş bir özgürlük içinde yaşama peşinde olan teşkîlâtlanmamış gençlerin oluşturduğu topluluğa mensup kimse, Hippi
H, Bitkilerin çürümesiyle oluşan koyu renkte organik toprak, Humus
H, Ezilmiş nohuta tâhin ve limon suyu karıştırdıktan sonra üzerine zeytin yağı, kırmızı biber, maydanoz konularak yapılan bir Arap yemeği, Humus
H, Para karşılığında yıkanma işinin yapıldığı yer, Hamam
H, Yahudi din adamı, Haham
H, Nazi Almanyası tarafından Avrupa Yahudilerine yönelik soykırım, Holokost/Holocaust
H, Ucu eğri ve sivri, kamaya benzer, silah olarak kullanılan bir bıçak türü, Hançer
H, Günümüzde Çorum sınırları içinde kalan, Hititler'in Tunç Çağı'ndaki başkenti, Hattuşa/Hattuşaş
H, Göze göz, dişe diş mantığıyla yasalar yazan, Babil Hanedanlığı'nın eski kralı, Hammurabi
H, Hz. İsa'nın öğüt ve inançlarını yayma işiyle görevlendirdiği on iki yardımcısından her biri, Havari
H, Şehir, hisar, kale, tarla vb. yerlere girilmesini önlemek, arâzide, yol kenarlarında suların akmasını sağlamak için kazılan, iki tarafı yüksek, uzunlamasına derin çukur, Hendek
H, Kur’ân-ı Kerim’i başından sonuna kadar ezberden veya yüzünden okuma, Hatim
H, Sağlığa zarar verecek ortamlardan korunmak için yapılacak uygulamalar ve alınan temizlik önlemlerinin tümü, Hijyen
H, Madenlerle birleştiğinde tuz verebilen 7A grubu elementleri flor, klor, brom, iyot, astatin ve tenesin'e verilen ortak ad, Halojen/Halojenler
H, Vücudun bir kısmında oluşturulan sonrada difüzyonla yada kan dolaşımıyla diğer kısımlarındaki hücrelere taşınarak onların çalışmalarını düzenleyen özel madde, Hormon
H, İnsanı merkeze alan, insan değerine ve aklına önem veren düşünce sistemi, Hümanizm
H, Derinin, dokuların ve organizmadaki sıvıların sarı bir renk almasıyla beliren hastalık, sarılık, Hepatit
H, Arap alfabesiyle yazılmış metinlerde üstüne ve altına konulduğu ünsüzlerin birer ünlü ile okunmasını sağlayan işaret, Hareke
H, Beceri isteyen ustalık, Hüner
H, Osmanlılarda yalnız padişahlar için kullanılan bir ünvan, Hünkar
H, Gönül temizliği, saf olma, Hulus
H, Hastalıkla gelen şiddetli ateş, Humma
H, Bir sıvıyı ağzı dar bir kaba aktarmak için kullanılan koni biçimindeki araç, Huni
H, Bir alacağın ödenmesi için borçlunun parasına, aylığına veya malına icra dairesi tarafından el konulması, Haciz
H, Su biriktirme, yüzme, çevreyi güzelleştirme vb. amaçlarla altı ve yanları mermer, beton benzeri şeylerden yapılarak içine su doldurulan, genellikle üstü açık yer, Havuz
H, Tahta ve kereste biçmeye yarayan, elektrik veya su gücüyle çalışan büyük bıçkı, Hızar
H, Aynı düşüncede, aynı görüşte olan, Hemfikir
H, Yünü, pamuğu yay veya tokmak gibi bir araçla kabartma işini yapan kimse, Hallaç
H, Osmanlı Devleti'nde bir görevde eskimiş olanlara verilen ünvan, Haseki
H, Gömülü veya saklıyken bulunan değerli şeylerin bütünü, Hazine
H, Cami, türbe, tekke vb. yerlerde çevresi parmaklıklarla çevrili mezar yeri, Hazire
H, Madenleri tel durumuna getirmek için kullanılan ve türlü çapta delikleri olan çelik araç, Hadde
H, "Benzer biçimde" anlamına gelen Arapça kökenli bir zarf, Hakeza
H, Kumun çimento veya kireç ile karıştırılmasından meydana gelen ve yapılarda taş ve tuğla örgüsünün yapıştırılmasında, duvarların sıvanmasında kullanılan, koyu bulamaç kıvamındaki madde, Harç
H, Yükseköğrenim öğrencilerinin ödemek zorunda olduğu katkı payı, Harç
H, Bir kişi veya bir mesele hakkındaki gizli şeyleri araştırıp ilgililere haber veren kimse, dedektif, Hafiye
H, Dibine konan ağırlık sebebiyle devrilmesi istense de hep dik duran oyuncak, Hacıyatmaz
H, Evlilik yoluyla birbirine bağlı olan kimseler, Hısım
H, Issız yerde yalnız kalma, Halvet
H, Beklenmedik, garip bir şeyin sebep olduğu şaşkınlık, Hayret
H, Ailede yaşlı ve saygı duyulan kadın, Haminne
H, "Nerede, ne oldu, nerede kaldı" anlamlarında kullanılan bir zarf, Hani
H, Unun su veya başka sıvılarla yoğrulmuş durumu, Hamur
H, Birbiri ardınca gelen yedi günlük dönem, Hafta
H, Aykırı düşüncelere veya ilkelere saplanmış, Heterodoks
H, Suudi Arabistan'ın Mekke şehri yakınlarındaki Nur Dağı'nda bulunan, İslam peygamberi Hz. Muhammed'e 610 yılında ilk vahyin Cebrail aracılığıyla indirildiği ve inzivaya çekildiği kutsal mekân, Hira/Hira Mağarası
H, Canlı bir organizmanın değişen dış çevre koşullarına rağmen iç ortamını kararlı, dengeli ve sağlıklı bir seviyede tutma yeteneği, Homeostaz/Homeostazi
H, Yapımı ve bakımı özen isteyen, aksamadan çok doğru çalışan, kesin ölçüler gerektiren işlerde kullanılan alet, Hassas
H, Duyarlılık, Hassasiyet
H, At yarışlarında binicilerle eyerin toplam ağırlığının, atların koşuyu kazanma şansını etkileyecek biçimde ayarlanması, Handikap
