letter, question, answer
Z, İnsanların maddeye dayanan gereksinimlerini karşılamak için yapılan, öğrenimle birlikte deneyim, beceri ve ustalık gerektiren iş, Zanaat
Z, Tutanak, Zabıt
Z, Orta oyununda veya Karagöz'de kadın rolüne çıkan erkek oyuncu, Zenne
Z, Cam parlaklığında, yeşil renkte, saydam bir süs taşı, Zümrüt
Z, Kötü sonuçlanmış bir işte, çok önemsiz iyi bir yan bularak sevinme, Züğürt Tesellisi
Z, Deprem, Zelzele
Z, Birbirini izleyen, art arda gelen, Zincirleme
Z, Burçlar kuşağı, Zodyak
Z, Yakınma veya hafifseme yoluyla şimdiki zaman, Zamane
Z, Bir nesnenin görüntüsünü büyütmek için objektifin odak uzaklığını değiştirmek, Zumlamak
Z, Hor görülen, aşağı tutulan, aşağılana, Zelil
Z, Deride, sinirler boyunca, özellikle gövde, bacak ve yüzde birtakım ağrılı fiskelerle beliren, mikroplu bir hastalık, Zona
Z, Zenginlerin sahip olduğu mal ve paranın kırkta birinin fakirler başta olmak üzere Kur’an’ın belirlemiş olduğu yerlere dağıtılmasını öngören, İslam’ın beş şartından biri, Zekat
Z, Tutuklu veya hükümlülerin içine konulduğu kapalı yer, Zindan
Z, İsim olmadıkları halde cümlede varlıkların veya kavramların yerini tutan sözcük türü, Zamir